"@rubio4805","2018-05-20 23:50:51","Monumental! Hoy un río humano grita #DuqueGanador en Bogotá. Este 27 de mayo vamos a ganar en primera vuelta. La esperanza vive: Ivan Duque Presidente. https://t.co/2OYp68Zkmn"
"@ronaldleon2111","2018-05-20 23:50:52","Nuestro presidente @Baena en compañía de los representantes @AnaPaolaAgudelo y @carlos_guevara en cierre de campaña de @IvanDuque y @mluciaramirez en el Parque el Tunal. Por la democracia en Colombia #DuqueGanador 🇨🇴 https://t.co/imS8UgFVEI"
"@deerecomunsas","2018-05-20 23:50:53","A una semana de elecciones: !Llegó la hora! !Llegó la hora del cambio! !Llegó la hora de la esperanza! !Llegó la hora de Colombia! !Llegó la hora de @IvanDuque! https://t.co/e9QhlgixXk"
"@jmorales_c","2018-05-20 23:50:54","@IvanDuque y @mluciaramirez son la esperanza de Colombia. Acabemos el próximo domingo de una vez la incertidumbre sobre el futuro del país y cerremos la puerta al Socialismo del SXXI. Vote #DuqueGanador https://t.co/vy6IQEuK2z"
"@ronaldleon2111","2018-05-20 23:50:55","Nuestro presidente @Baena en compañía de los representantes @AnaPaolaAgudelo y @carlos_guevara en cierre de campaña de @IvanDuque y @mluciaramirez en el Parque el Tunal. Por la democracia en Colombia #DuqueGanador 🇨🇴 https://t.co/imS8UgFVEI"
"@LuisaposadaO","2018-05-20 23:50:55","Magnifico cierre de campaña en Purificación. La comunidad firme con @IvanDuque, gracias a nuestro amigo @RicardoFerro_ por acompañarnos @AliciaArango https://t.co/8uDLLPJwAx"
"@JUANKMOR","2018-05-20 23:54:36","El 27 de Mayo, votaré en Pereira, luego viajaré con mi hijo a Cali para que él vote, y en la tarde regresaremos a Pereira...hay que hacerlo, todos los votos cuentan, para que ganemos la presidencia con @IvanDuque , el de @AlvaroUribeVel , en primera vuelta!!!"
"@Isdapudi95","2018-05-20 23:54:36","@CancinoAbog @drnadermora @Isdapudi95 @foreroca @fefernandezt @JuanRealDC @IvanDuque Yo pienso que Duque gana en primera, pero también pienso que sí hay segunda vuelta, no vamos a ver el superclásico Duque vs Petro, sino un Duque vs Vargas..."
"@MiguelGonzlez11","2018-05-20 23:54:36","@RevistaSemana @IvanDuque @German_Vargas Vayan preparándole el entierro de cuarta categoría a la candidatura del tal iván duque marqués a realizarse el domingo 27 mayo de 2018 a lo largo y ancho del territorio colombiano."
"@JoosepthS","2018-05-20 23:54:36","Futuro Presidente de Colombia, @IvanDuque y futura Primera Dama de la Nación, María Juliana Ruiz. #DuqueGanador #DuqueEnPrimeraVuelta https://t.co/QfGTiCigFk"
"@judas77","2018-05-20 23:54:36","@UneteoJodete @SamuelHoyosM @IvanDuque @mluciaramirez Es verdad pero aca le tengo una toma mas real  https://t.co/J0U8qBBYEu https://t.co/NNh8lNDpZE"
"@JulianaGuzman09","2018-05-20 23:54:37","#ConMiraDuquePresidente #DuqueGanador #Miraístas @MovimientoMIRA  acompañan #CierreDeCampaña de @IvanDuque @mluciaramirez @Baena @irmalherrera @Virguez @gloria_stella @AnaPaolaAgudelo https://t.co/OcoaqSIzuE"
"@JulianaGuzman09","2018-05-20 23:54:39","Retweeted Álvaro Uribe Vélez (@AlvaroUribeVel):  "Decían que era muy pollo. Ya se dieron cuenta que aquí lo que hay es un gallo de pelea para defender a Colombia": @IvanDuque #DuqueGanador"
"@joosorvacassill","2018-05-20 23:54:41","@RevistaSemana @IvanDuque @German_Vargas Duque tu no eres nadie políticamente, ni eres un líder, tu no buscabas trabjar por 🇨🇴 Colombia, ni tienes eso que tienen los lideres como Ghandi, Mandela, Obama, tú simplemente eres un titere de ls circunstancia y gracias al miserable de Uribe estás ahí dándotelas de sobrado!"
"@hugoromanov","2018-05-20 23:54:43","Uno tiene que ser un completo imbecil, carente de afecto y con muchas ganas de llamar la atención para utilizar una foto de un concierto de RAMMSTEIN y decir que es gente apoyando a @IvanDuque 😂 https://t.co/WLaq8DUvv6"
"@avella_mario","2018-05-20 23:54:45",""Llegar juntos es el comienzo. Avanzar juntos es el progreso. Trabajar juntos es el éxito" (Henry Ford) @Baena @IvanDuque @MovimientoMIRA @CeDemocratico #ConMIRADuquePresidente https://t.co/5IKmVZeRu6"
"@kikebecerra22","2018-05-20 23:54:45","Cierre de campaña @IvanDuque presidente, @mluciaramirez vicepresidente. Con ayuda de los compatriotas, que queremos recuperar el país, el próximo domingo estaremos celebrando el triunfo. Transmisión: https://t.co/daI4X9ZDx7 #DuqueGanador"
"@AndyFx900","2018-05-20 23:54:46","@CancinoAbog @drnadermora @Isdapudi95 @foreroca @fefernandezt @JuanRealDC @IvanDuque Incluso, me atrevo a afirmar que hasta Fajardo tiene una gran oportunidad de quedarse con el segundo lugar... Ya veremos"
"@ronaldleon2111","2018-05-20 23:54:48","EN ESTE MOMENTO  Transmisión en vivo de cierre de campaña de @IvanDuque con la compañía de la bancada de @MovimientoMIRA   #DuqueGanador   https://t.co/1ojmZVEgef"
"@arivasca311","2018-05-20 23:54:48","#ElFuturoEsDeTodos @IvanDuque #Presidendente @mluciaramirez #Vicepresidente #DuqueEsElQueEs @AlvaroUribeVel @CeDemocratico #ColombiaEstáConDuque #DuqueEnPrimeraVuelta #FelizSábado #DuquePresidente https://t.co/rHNEmn4QrC"
"@LeNgUaSaRcAsTiC","2018-05-20 23:54:48","@AlvaroUribeVel @IvanDuque @mluciaramirez #UribeMentirosoMentiroso  Estos tweets tienen características alucinógenas, como las drogas ilegales; tienen a sus consumidores con las neuronas vueltas materia fecal."
"@cavm_villa","2018-05-20 23:54:48","Mientras algunos tratan de estimular el odio de clases, @IvanDuque y @mluciaramirez han propuesto un país sin derroche, con menos impuestos, sin desgreño, con una economía Cristiana que, sustancialmente, incremente el salario mínimo de los colombianos #DuqueGanador"
"@miller_sandra","2018-05-20 23:54:50","@JCGossain @MerceBza @marcoschacon16 Jejejeje Sr @JCGossain le recomiendo ver un poco el cierre de @IvanDuque y luego habla, los URIBISTAS dormimos siempre tranquilos porqué estamos con Dios, mientras otros no lo pueden hacer porque están con el diablo, y recuerde que el diablo entra por el bolsillo."
"@PuyonCaronte","2018-05-20 23:54:50","Bueno no se asusten, Vargas Lleras también llenó la plaza de Bolívar en Bogotá. Lo importante es que @IvanDuque va a llenar son las urnas de votos y va a ganar en primera vuelta! ¡Póngale la firma! @Marangarcia @Rchagui @FEBUVE @ElNegrovicto https://t.co/y5pKtp3Brn"
"@rojorestrepo","2018-05-20 23:54:51","Gran cierre de campaña en Bogotá, de @IvanDuque y @mluciaramirez gracias a todos los asistentes por su apoyo #DuquePresidente #DuqueEnPrimera  #DuqueEnElTunal @CeDemocratico https://t.co/eR6Vltrvow"
"@ronaldleon2111","2018-05-20 23:54:51","Nuestro presidente @Baena en compañía de los representantes @AnaPaolaAgudelo y @carlos_guevara en cierre de campaña de @IvanDuque y @mluciaramirez en el Parque el Tunal. Por la democracia en Colombia #DuqueGanador 🇨🇴 https://t.co/imS8UgFVEI"
"@GPATTYVT","2018-05-20 23:54:52","Que alguien le diga a @petrogustavo que esto no es montaje!!! Y que Ivan Duque es el próximo presidente de Colombia 🇨🇴 digna, justa, honesta, segura, próspera, libre, defensa de valores morales de nuestra ños, jóvenes y nuevas generaciones. Unida Colombia vota por  “Ivan Duque” https://t.co/0uBlnVCcKh"
"@NicolasLopezCo","2018-05-20 23:54:53","A una semana de elecciones: !Llegó la hora! !Llegó la hora del cambio! !Llegó la hora de la esperanza! !Llegó la hora de Colombia! !Llegó la hora de @IvanDuque! https://t.co/e9QhlgixXk"
"@robercarmona84","2018-05-20 23:54:53","@RevistaSemana @IvanDuque Vea no sabía que la @RevistaSemana es propiedad del Centro democrático toda la tarde por twitter con las declaraciones de Iván duque. Con razón en sus encuestas sube tanto"
"@alva24gr","2018-05-20 23:54:53","Mi esposa, mis hijos y yo nos ponemos la camiseta por el futuro de los niños colombianos. Ellos merecen un país donde puedan crecer libres y tranquilos. Por eso, les inculcamos los valores familiares y democráticos que me enseñaron mis padres. Y votaremos @IvanDuque presidente. https://t.co/FWEIMMtlyT"
"@JAIGUEGO","2018-05-20 23:54:55","Gran cierre de campaña @IvanDuque en el parque El Tunal en Bogotá. ¡Vamos a ganar en primera vuelta!  Iván Duque Presidente Marta Lucía (@mluciaramirez) Vicepresidente #DuqueGanador https://t.co/5SD1SIukEX"
"@inmsu","2018-05-20 23:54:55","Un llamado de @JaimeCastroC que lo dice todo: "Si decidió votar por Ivan Duque en la segunda vuelta, hágalo en la primera, para que el pais ahorre los costos políticos, económicos y fiscales que tiene la segunda". #EnPrimeraVuelta"
"@currambero1","2018-05-20 23:54:56","Cierre de campaña Iván Duque @IvanDuque en el Tunal, Bogotá. Simplemente #ColombiaEstáConDuque . Ganemos en 1ra vuelta. #DuqueEsElQueEs #DuquePresidenteEnPrimeraVuelta https://t.co/KUnQezDOZh"
"@rojorestrepo","2018-05-20 23:54:58","Mientras algunos tratan de estimular el odio de clases, @IvanDuque y @mluciaramirez han propuesto un país sin derroche, con menos impuestos, sin desgreño, con una economía Cristiana que, sustancialmente, incremente el salario mínimo de los colombianos #DuqueGanador"
"@angelicamoyarom","2018-05-20 23:55:00","Somos @Colombianos_Ext #AlemaniaMiraista vota si #AcuerdoProgramático porque #ConMIRADuquePresidente @Baena @AnaPaolaAgudelo @IvanDuque @NoticiasCaracol @CABLENOTICIAS @NoticiasRCN https://t.co/bbuv58FFFQ"
"@MJara2018","2018-05-20 23:55:00","@IvanDuque @mluciaramirez @AlvaroUribeVel @CeDemocratico Cambio... que mentira. Solo que sea el que dijo Uribe es MÁS DE LO MISMO PA'LOS MISMOS."
"@manuelandresle3","2018-05-20 23:55:02","Que alguien le diga a @petrogustavo que esto no es montaje!!! Y que Ivan Duque es el próximo presidente de Colombia 🇨🇴 digna, justa, honesta, segura, próspera, libre, defensa de valores morales de nuestra ños, jóvenes y nuevas generaciones. Unida Colombia vota por  “Ivan Duque” https://t.co/0uBlnVCcKh"
"@chinome2018","2018-05-20 23:55:02","Atención amigos de colombia humana, la gobernadora del valle Dilian francisca toro, hace un mes nos estaba presionando a todos los funcionarios públicos y contratistas que teníamos que hacerle campaña a Germán Vargas, ahora nos está presionando para que votemos por IVAN DUQUE."
"@SusanaGarzon3","2018-05-20 23:55:02","Es la imagen de las 2 de la tarde en el Parque del Túnel, en el cierre de la Campaña de #DuquePresidente  No es la Plaza de Bolívar llena de curiosos, no, es la gente que acompaño con fervor a @IvanDuque  como #DuquePresidente https://t.co/fn8RBkTtRd"
"@RENGIFOGIRONZA","2018-05-20 23:55:03","Mientras algunos tratan de estimular el odio de clases, @IvanDuque y @mluciaramirez han propuesto un país sin derroche, con menos impuestos, sin desgreño, con una economía Cristiana que, sustancialmente, incremente el salario mínimo de los colombianos #DuqueGanador"
"@LaurisOrozcoL","2018-05-20 23:55:03","#CierreDeCampaña | “Dijeron que Duque era un pollo, pero ya se dieron cuenta que lo que aquí hay es un gallo de pelea”, dice @IvanDuque , refiriéndose a la famosa frase que le lanzó @German_Vargas hace meses https://t.co/GBdRifAzSv https://t.co/KCze7ve5E0"
"@jjUscategui","2018-05-20 23:55:04","Hoy @IvanDuque y @mluciaramirez pronunciaron un discurso histórico en el parque El Tunal de #Bogotá. La victoria, con la bendición del cielo, está cerca!! #DuquePresidenteEnPrimeraVuelta https://t.co/M4sHavp0zH"
"@eliafaher","2018-05-20 23:55:05","Aviso importante: señores mamertos , Ivan Duque es un hombre inteligente y llegará a gobernar para todos , sin odios ni revanchismos , lo de el es la democracia y el bienestar para todos ..nada de nervios que a diferencia de su candidato, el no quiere prender a Colombia."
"@juanfe8016","2018-05-20 23:55:05","@RevistaSemana @IvanDuque @IvanDuque debe ser el nuevo Presidente de Colombia, para que acabemos con lo que odiamos que es la politiquería y las Famosas Maquiavélica  Maquinarias Políticas que está acabando con nuestros recursos ..Saquemos el Odio #DuqueGanador"
"@SebHayek","2018-05-20 23:55:05","@andreabuitragov La maquinaria no pone presidentes, tal vez en desempate, mira los pantallazos  Me preocupa más un fenómeno como Petro, con un espejo como el de 🇻🇪 , con su modelo llevó a la quiebra a un país , ha seguir trabajando para que @IvanDuque sea presidente https://t.co/2N9QrsR28N"
"@mafer0687","2018-05-20 23:55:06","Un estadista jamás es títere de otros. Sólo obedece a los intereses nacionales . He visto en @IvanDuque un estadista//. ¿Usted será un títere de Uribe? Así nos respondió Iván Duque via @elPaiscali https://t.co/7YkBBhb8ZH"
"@JuanAguja","2018-05-20 23:55:07","Echemos números: Cierres de campaña bogotá. Transmisiones en facebook.  @petrogustavo  405mil reprod. 13mil veces comp. 14mil Reacciones  @IvanDuque  33mil reprod. 908 veces comp. 4,1mil Reacciones  @German_Vargas  1mil reprod. 298 veces comp. 1,2mil Reaccio #NoAlFraudeElectoral"
"@cavm_villa","2018-05-20 23:55:07","Increíble!!!!!  Monumental... @IvanDuque tuvo que hacer su cierre de campaña en el Parque El Tunal porque nuestra Plaza de Bolívar le quedó muy chiquita!!!!!  Aquí se ve lleno por fuera de los límites que se pusieron en el Parque!!!  Bravo!!!!!!👏👏👏👏👏👏👏👏 https://t.co/uH6B7yRbGF"
"@BuenahoraR","2018-05-20 23:55:08","Gran cierre de campaña de @IvanDuque y @mluciaramirez  en Bogotá @MovimientoMIRA presente en compañía de @Baena @gloria_stella @AnaPaolaAgudelo @carlos_guevara y nuestros valiosos líderes. ¡El próximo 27 de mayo, vamos a ganar en primera vuelta! 🇨🇴 #ConMIRADuquePresidente https://t.co/WtcrE97754"
"@inesag62","2018-05-20 23:55:10","Este 27 de mayo vamos a ratificar en las urnas que el proyecto de país de @IvanDuque Presidente y @mluciaramirez Vicepresidente es el mejor. Vamos a decirle no más al continuismo santista y al socialismo del siglo XXI. #DuqueEnPrimeraVuelta https://t.co/ymOezpdhJH"
"@BuenahoraR","2018-05-20 23:55:10","EN ESTE MOMENTO  Transmisión en vivo de cierre de campaña de @IvanDuque con la compañía de la bancada de @MovimientoMIRA   #DuqueGanador   https://t.co/1ojmZVEgef"
"@rojorestrepo","2018-05-20 23:55:32","Cierre de campaña en.Bogotá de @IvanDuque y @mluciaramirez, ellos harán un gobierno de unión de los colombianos donde el futuro sea de Todos https://t.co/BuBId9fzar"
"@rodrigoposso","2018-05-20 23:55:34","Monumental! Hoy un río humano grita #DuqueGanador en Bogotá. Este 27 de mayo vamos a ganar en primera vuelta. La esperanza vive: Ivan Duque Presidente. https://t.co/2OYp68Zkmn"
"@13colombia13","2018-05-20 23:55:36","Las propuestas de @IvanDuque con el Valle del Cauca. Muestra de su compromiso y profundo conocimiento de las necesidad que tiene nuestra región #DuqueConLasRegiones #DuqueEsElQueEs https://t.co/ajuCbxpWZU"
"@inesag62","2018-05-20 23:55:36","@CarlosHolmesTru @IvanDuque @mluciaramirez @CeDemocratico @AlvaroUribeVel @charoguerra @AliciaArango @OIZuluaga Dr. Carlos Usted a aportado toda su capacidad y experiencia a esta campaña. Adelante, Dios lo guarde y que en la Presidencia de Duque Usted siga siendo la brújula."
"@rojorestrepo","2018-05-20 23:55:37","Mi esposa, mis hijos y yo nos ponemos la camiseta por el futuro de los niños colombianos. Ellos merecen un país donde puedan crecer libres y tranquilos. Por eso, les inculcamos los valores familiares y democráticos que me enseñaron mis padres. Y votaremos @IvanDuque presidente. https://t.co/FWEIMMtlyT"
"@jivarahi","2018-05-20 23:55:37","Si ves el abuso y  el descaro de la @JurisdiccPaz, sabes que no queda otra opción que votar por @IvanDuque, es una vergüenza este cartel de impunidad!!"
"@ronaldleon2111","2018-05-20 23:55:38","Gran cierre de campaña de @IvanDuque y @mluciaramirez  en Bogotá @MovimientoMIRA presente en compañía de @Baena @gloria_stella @AnaPaolaAgudelo @carlos_guevara y nuestros valiosos líderes. ¡El próximo 27 de mayo, vamos a ganar en primera vuelta! 🇨🇴 #ConMIRADuquePresidente https://t.co/WtcrE97754"
"@Hector_Sagre","2018-05-20 23:55:42","El guerrillero Gustavo Petro ya está convocando a todos sus colectivos a prender a Colombia si Ivan Duque gana en primera vuelta. Así son las cosas con los ifueputas terroristas. Nosotros con ganas de gozarnos una fiesta democrática y este ifueputa llamando a la violencia."
"@ronaldleon2111","2018-05-20 23:55:42","EN MINUTOS: Transmisión en vivo desde el Parque el Tunal con la bancada del Partido acompañando cierre de campaña de @IvanDuque y @mluciaramirez #DuqueGanador 🇨🇴 https://t.co/9Y54TLjsag"
"@aljorge46","2018-05-20 23:55:42","EN MINUTOS: Transmisión en vivo desde el Parque el Tunal con la bancada del Partido acompañando cierre de campaña de @IvanDuque y @mluciaramirez #DuqueGanador 🇨🇴 https://t.co/9Y54TLjsag"
"@ronaldleon2111","2018-05-20 23:55:45","AHORA: Transmisión en vivo desde el Parque el Tunal con la bancada y líderes del Partido acompañando cierre de campaña de @IvanDuque y @mluciaramirez #DuqueGanador 🇨🇴    En vivo: https://t.co/DEQYvyDCZP"
"@VictorV78490181","2018-05-20 23:55:45","Mientras algunos tratan de estimular el odio de clases, @IvanDuque y @mluciaramirez han propuesto un país sin derroche, con menos impuestos, sin desgreño, con una economía Cristiana que, sustancialmente, incremente el salario mínimo de los colombianos #DuqueGanador"
"@TwittPensador","2018-05-20 23:55:45","La victoria se refleja en cierre de campaña en Bogotá de @IvanDuque y @mluciaramirez multitudinaria concentración en parque del Tunal al sur de la capital, augura que vamos a ganar en primera vuelta. https://t.co/hhKhDJ5Rtg"
"@MarteloAngie","2018-05-20 23:55:46","Cierre de campaña Iván Duque @IvanDuque en el Tunal, Bogotá. Simplemente #ColombiaEstáConDuque . Ganemos en 1ra vuelta. #DuqueEsElQueEs #DuquePresidenteEnPrimeraVuelta https://t.co/KUnQezDOZh"
"@Alejoball","2018-05-20 23:55:46","Hoy @IvanDuque y @mluciaramirez pronunciaron un discurso histórico en el parque El Tunal de #Bogotá. La victoria, con la bendición del cielo, está cerca!! #DuquePresidenteEnPrimeraVuelta https://t.co/M4sHavp0zH"
"@kikebecerra22","2018-05-20 23:55:46","En una semana estaremos decidiendo el futuro de nuestro país. Tripliqueños esfuerzos y multipliquemos los votos, para que @IvanDuque sea nuestro presidente y @mluciaramirez nuestra vicepresidente, desde la noche del domingo.  ¡Ganemos #EnPrimeraVuelta!"
"@Anaisabel4349","2018-05-20 23:55:47","@krlitosarias03 @choriangel @petrogustavo @IvanDuque Claro, siempre tiene esa opción de ponerlo privado, usted decide. Yo nunca pensaría que usted por ser seguidor de Petro es guerrillero, usted tiene el derecho a votar por el candidato de su preferencia y yo no lo insulto, es ahí donde radica la diferencia entre ud y yo."
"@JoosepthS","2018-05-20 23:55:49","Cierre de campaña de @IvanDuque y @mluciaramirez en Bogotá. Por la unión de la Patria, por mayor legalidad, emprendimiento y justica social, votaremos este 27 de mayo por nuestra fórmula a la Presidencia y Vicepresidencia. https://t.co/reEFw7iNvT"
"@rodrigoposso","2018-05-20 23:55:50","#DuqueGanador Los Colombianos de hoy no nos dejamos alucinar por un demagogo dotado del talento de despertar odios y atizar atabismos de violencia, con un discurso embriagador de denuncias de corruptelas presentes y heroicidades pasadas, por eso elegimos a @IvanDuque https://t.co/ZTsj4uxcdL"
"@lugicas","2018-05-20 23:55:52","¡En 1a! ¡En 1a! ¡En 1a! Iván Duque es la esperanza de Colombia. Petro con el cuento del fraude, indica su derrota. Así @JuanManSantos y su horda de corruptos apelen a lo más ruin para evitar su triunfo, no lo lograrán. Sindéresis. Confianza en Dios. @IvanDuque. https://t.co/uKlnOCHqoW"
"@NumGel","2018-05-20 23:55:54","@sllucchese @SEBINoficial @FARC_EPueblo @ANIABELLO_R @MargaritaRepo @AlvaroUribeVel @Almagro_OEA2015 @omarbula @GermanEspejo_ @IvanDuque @saludhernandezm @mluciaramirez un regalote"
"@MCristi66485088","2018-05-20 23:55:55","Que alguien le diga a @petrogustavo que esto no es montaje!!! Y que Ivan Duque es el próximo presidente de Colombia 🇨🇴 digna, justa, honesta, segura, próspera, libre, defensa de valores morales de nuestra ños, jóvenes y nuevas generaciones. Unida Colombia vota por  “Ivan Duque” https://t.co/0uBlnVCcKh"
"@Vicme100","2018-05-20 23:55:55","Monumental! Hoy un río humano grita #DuqueGanador en Bogotá. Este 27 de mayo vamos a ganar en primera vuelta. La esperanza vive: Ivan Duque Presidente. https://t.co/2OYp68Zkmn"
"@GabaBot","2018-05-20 23:55:55","Monumental! Hoy un río humano grita #DuqueGanador en Bogotá. Este 27 de mayo vamos a ganar en primera vuelta. La esperanza vive: Ivan Duque Presidente. https://t.co/2OYp68Zkmn"
"@mao2371","2018-05-20 23:55:56","Mientras algunos tratan de estimular el odio de clases, @IvanDuque y @mluciaramirez han propuesto un país sin derroche, con menos impuestos, sin desgreño, con una economía Cristiana que, sustancialmente, incremente el salario mínimo de los colombianos #DuqueGanador"
"@todoscolombia","2018-05-20 23:55:57","@Andrujar81 @MamertoNada @COLOMBOVENZLANA @MiguelS69397877 @adcorrea @CarrillonavasG @indignada2016 @MunozEnith @MHOYOS333 @stefaniasandrip @SaidSaher1 @davidCalonge3 @mabelitaccb @phadi0321 @MauricioRudolf @VancliffDesign @aleger73 @Comochonta @NANACHAGU @Eltabano03 @biolucho2005 @ecucol @alebaraya @IvanDuque @petrogustavo @LuqueCampo @diana_giraldo1 @ghitis @lacoutu @8verona @JoseFdoSanin @PadreJosePalmar @josel_6027 @jbagbam74 @ADJusticia @The__Bosch @Horadelaverdad @CHC31 @CarlosS82074261 @TorresAren @JJRENDON @JESUSESA @Popeye_leyenda @ReinaldoProfeta @JuanpTello @JavierEnBogota @Bilancieri @VicmarBarbie @carmen16181223 @RossVzla29 Haber déjame entenderte: petro no es responsable de lo que SU grupo hacía pero Uribe es responsable de lo que unos soldados corruptos que están presos hicieron ? https://t.co/Eo4m5mFxjz"
"@merecumbiandofu","2018-05-20 23:55:59","Por aquí en el CENTRO, me dieron la oportunidad de montarme a este BUS...Seguimos UNO a UNO, aprovechando todos los medios y todos los espacios para hablar de este equipo!!  #DuqueEnPrimera #MedellínConDuque #EsElQueEs  . . @IvanDuque @AlvaroUribeVel @nperezvasquez @CeDemocratico https://t.co/ffNKNpbybU"
"@abilio_camano","2018-05-20 23:55:59","Mientras algunos tratan de estimular el odio de clases, @IvanDuque y @mluciaramirez han propuesto un país sin derroche, con menos impuestos, sin desgreño, con una economía Cristiana que, sustancialmente, incremente el salario mínimo de los colombianos #DuqueGanador"
"@lugicas","2018-05-20 23:56:00","@Olgercohen ¡En 1a! ¡En 1a! ¡En 1a! Iván Duque es la esperanza de Colombia. Petro con el cuento del fraude, indica su derrota. Así @JuanManSantos y su horda de corruptos apelen a lo más ruin para evitar su triunfo, no lo lograrán. Sindéresis. Confianza en Dios. @IvanDuque."
"@davidbautistaqf","2018-05-20 23:56:00","Uno tiene que ser un completo imbecil, carente de afecto y con muchas ganas de llamar la atención para utilizar una foto de un concierto de RAMMSTEIN y decir que es gente apoyando a @IvanDuque 😂 https://t.co/WLaq8DUvv6"
"@adolfolopezb","2018-05-20 23:56:01","A una semana de elecciones: !Llegó la hora! !Llegó la hora del cambio! !Llegó la hora de la esperanza! !Llegó la hora de Colombia! !Llegó la hora de @IvanDuque! https://t.co/e9QhlgixXk"
"@YuriRocio","2018-05-20 23:56:01","@Franklin_Morale @gloria_stella @olgamsilva @irmalherrera @OlgaVictoriaRC @MovimientoMIRA Q lastima q no pude ir a acompañarlos,  pero espero Dios mediante con toda mi familia y conocidos ir  a depositar nuestro voto por el Dr Ivan Duque."
"@GladyspReyes","2018-05-20 23:56:02","@JoseMAcevedo @manolitosalazar @petrogustavo @German_Vargas @IvanDuque @DeLaCalleHum @sergio_fajardo A Petro le cuesta el siempre quiere  conflicto , no demora hacer los shows en plena plaza de Bolívar como siempre payaso total"
"@ronaldleon2111","2018-05-20 23:56:03","Con @MovimientoMIRA al frente @IvanDuque Presidente, #ConMiraDuquePresidente @gloria_stella @irmalherrera   en Unicentro Bogotá https://t.co/TrJ5lDvpus"
"@FlorMalagon","2018-05-20 23:56:05","Un llamado de @JaimeCastroC que lo dice todo: "Si decidió votar por Ivan Duque en la segunda vuelta, hágalo en la primera, para que el pais ahorre los costos políticos, económicos y fiscales que tiene la segunda". #EnPrimeraVuelta"
"@dieghoa","2018-05-20 23:56:05","@IvanDuque @mluciaramirez @AlvaroUribeVel @CeDemocratico Lo salvaron los de MIRA solo camisetas azules, sino no alcanza a que medio parezca lleno."
"@admdorjri","2018-05-20 23:56:06","Seguimos en permamente diálogo con la comunidad del Valle del Cauca, compartiendo las propuestas de @IvanDuque y @mluciaramirez #DuquePresidente https://t.co/VZP45GomKW"
"@jag2kn","2018-05-20 23:56:06","¡FIASCO TOTAL! Raquítica asistencia en manifestación de @ivanduque en C/gena No fue suficiente presentación en tarima de cantantes Mr Black y Beto Zabaleta para llenar el emblemático Camellón de los Mártires Algo va de las "encuestas amañadas" a la movilización real en eventos https://t.co/NPuoUp0UMq"
"@dylanarevalo4","2018-05-20 23:56:06","@AlejoMartin365 @RevistaSemana @IvanDuque AHORA DIGALO SIN LLORAR 😭 @IvanDuque  MI PRESIDENTE LE HARE CASO A MI NUEVO PRESIDENTE Y PETRO A SEMBRAR 🥑😂"
"@jaimecabreramon","2018-05-20 23:56:06","Tenemos los mejores médicos para derrotar el mal de la corrupción. La transparencia de @IvanDuque y @mluciaramirez es garantía para la Patria. #DuqueGanador"
"@CESARAUGUSTOSU3","2018-05-20 23:56:07","@jamsosorio @AMagdoly @MauricioLizcano @petrogustavo @TodosConDuque @IvanDuqe @JuanManSantos @AlvaroUribeVel @IvanDuque  https://t.co/d0hla95hs4"
"@damzmolina","2018-05-20 23:56:07","@damzmolina Para combatir la ingenuidad y NO VOTAR x Petro como en Venezuela se hizo x Chávez:  "COMUNISTA QUE NO OCULTA SUS SEGUNDAS INTENCIONES NO ES COMUNISTA"  @IvanDuque @mluciaramirez"
