"@HernnDeJesus3","2018-05-20 23:37:04","Petro evade con otra respuesta, si lo comparan con Maduro y Hugo Chávez.  “El faraón de la corrupción” un burro hablando de orejas @petrogustavo   Yo voto por @IvanDuque en primera vuelta. https://t.co/Cev8hFmNIs"
"@erichdaniel","2018-05-20 23:37:06","El 27 de Mayo, votaré en Pereira, luego viajaré con mi hijo a Cali para que él vote, y en la tarde regresaremos a Pereira...hay que hacerlo, todos los votos cuentan, para que ganemos la presidencia con @IvanDuque , el de @AlvaroUribeVel , en primera vuelta!!!"
"@josejserna","2018-05-20 23:37:08","El gran ganador de esta campaña ha sido @IvanDuque  Joven, capacidad y visión de Estado y se ganó el corazón del electorado en una campaña honesta y limpia #DuqueGanador  Falta poco..."
"@HernanChelo","2018-05-20 23:37:09","El humanismo debe ser la base y aquí en el Tunal les digo que me la juego por devolverle a los colegios la cátedra de urbanidad: @IvanDuque @mluciaramirez @AlvaroUribeVel"
"@datos_jm","2018-05-20 23:37:09","Mientras algunos tratan de estimular el odio de clases, @IvanDuque y @mluciaramirez han propuesto un país sin derroche, con menos impuestos, sin desgreño, con una economía Cristiana que, sustancialmente, incremente el salario mínimo de los colombianos #DuqueGanador"
"@S118Inn","2018-05-20 23:37:10","Uno tiene que ser un completo imbecil, carente de afecto y con muchas ganas de llamar la atención para utilizar una foto de un concierto de RAMMSTEIN y decir que es gente apoyando a @IvanDuque 😂 https://t.co/WLaq8DUvv6"
"@AlmaGom72970689","2018-05-20 23:37:11","@mluciaramirez @IvanDuque @elpaiscali Ivan Duque es Uribista, no títere de Uribe. Que falta de respeto para con los DOS.  Ambos son estadistas y Presidentes de Colombia. Esperen y verán."
"@localoca2705","2018-05-20 23:37:13","Mientras algunos tratan de estimular el odio de clases, @IvanDuque y @mluciaramirez han propuesto un país sin derroche, con menos impuestos, sin desgreño, con una economía Cristiana que, sustancialmente, incremente el salario mínimo de los colombianos #DuqueGanador"
"@germanesangel","2018-05-20 23:37:13","Me duele decir esto y lo digo con el dolor de mi alma pero es la triste realidad, Colombia en este momento es el paraíso para los narcoterroristas y toda clase de criminales. Salvemos a Colombia con @IvanDuque Presidente.  @AlvaroUribeVel @mariojpachecog @NANACHAGU @MiguelPoloP https://t.co/z1yyVxot3l"
"@unsenadoFirme","2018-05-20 23:37:13","Buen día, esto es lo que piensa el senador @AABenedetti de @German_Vargas  y anoche él fue el que llevó varios asistentes al cierre de campaña en Quilla, la política es dinámica  @NANACHAGU  @IvanDuque  @AlvaroUribeVel https://t.co/YqyLK7YEdP"
"@pepenao1","2018-05-20 23:37:13","Increíble!!!!!  Monumental... @IvanDuque tuvo que hacer su cierre de campaña en el Parque El Tunal porque nuestra Plaza de Bolívar le quedó muy chiquita!!!!!  Aquí se ve lleno por fuera de los límites que se pusieron en el Parque!!!  Bravo!!!!!!👏👏👏👏👏👏👏👏 https://t.co/uH6B7yRbGF"
"@Katatoga","2018-05-20 23:37:15","Gran cierre de campaña de @IvanDuque y @mluciaramirez  en Bogotá @MovimientoMIRA presente en compañía de @Baena @gloria_stella @AnaPaolaAgudelo @carlos_guevara y nuestros valiosos líderes. ¡El próximo 27 de mayo, vamos a ganar en primera vuelta! 🇨🇴 #ConMIRADuquePresidente https://t.co/WtcrE97754"
"@vidarte62","2018-05-20 23:37:15","A una semana de elecciones: !Llegó la hora! !Llegó la hora del cambio! !Llegó la hora de la esperanza! !Llegó la hora de Colombia! !Llegó la hora de @IvanDuque! https://t.co/e9QhlgixXk"
"@CelsoMariaRoja2","2018-05-20 23:37:17","Tenemos los mejores médicos para derrotar el mal de la corrupción. La transparencia de @IvanDuque y @mluciaramirez es garantía para la Patria. #DuqueGanador"
"@guerrerodelmeta","2018-05-20 23:37:18","Gracias a Dios Colombia es un país donde aún se puede expresar la preferencia política. Yo espero respeto por mi decisión de apoyar a @IvanDuque .Tú? Elige con libertad, expresa tu opinión y engrandece la democracia en la que aún vivimos! #DuquePresidente"
"@oscarlopezcuer1","2018-05-20 23:37:20","Por que #ColombiaEstáConDuque ?  @IvanDuque es parte de la nueva generación de lideres mundiales.  Jovenes. Brillantes. Con alta formacion. Demócratas. Sin corrupción. https://t.co/k697TFlJ7f"
"@leelcaballero","2018-05-20 23:37:20","Hoy Bogotá demuestra que quiere a Ivan Duque Presidente en primera vuelta. Este 27 de mayo vamos a derrotar el socialismo chavista y el continuismo santista. https://t.co/VNcrjCBQn8"
"@YolandaPuentes8","2018-05-20 23:37:20","@RevistaSemana @IvanDuque S copio de PETRO Jajajaja Jajajaja Jajajaja.......juéguesela diciendo que no va alcaguetiar más a uribe y vera invente no se copie.......a Petro le dijo que eso costaba mucho y Ud como lo va hacer .....pura m...carreta"
"@AlbenisMarlon","2018-05-20 23:37:21","@Oj0Critico @PulsoDeIFutbol @IvanDuque @German_Vargas @petrogustavo esto solo es un hevidero electoral, un tira que jale. todos los candidatos andan haciendo para confundir a los colombianos para que uno escoja el que mas bulla haga,  pero a la final uno es el perjudicado por que uno es quien elije y esos malnacidos siguen dandole palo a uno"
"@berniprimero","2018-05-20 23:37:21","Tenemos los mejores médicos para derrotar el mal de la corrupción. La transparencia de @IvanDuque y @mluciaramirez es garantía para la Patria. #DuqueGanador"
"@lugicas","2018-05-20 23:37:21","¡En 1a! ¡En 1a! ¡En 1a! Iván Duque es la esperanza de Colombia. Petro con el cuento del fraude, indica su derrota. Así @JuanManSantos y su horda de corruptos apelen a lo más ruin para evitar su triunfo, no lo lograrán. Sindéresis. Confianza en Dios. @IvanDuque. https://t.co/W3CvbqzKcV"
"@jawis123","2018-05-20 23:37:22",""Yo no tengo como interlocutor criminales. Yo jamás en mi vida he cometido un crimen. Este país no aguanta más a los terroristas posando de prohombres": @IvanDuque https://t.co/kJ7o1NVnZr"
"@LeonidesArauz","2018-05-20 23:37:23","Retweeted Iván Duque (@IvanDuque):  Hoy durante las emisiones de @noticiasrcn conozca mis propuestas para impulsar el deporte en #Colombia #ElFuturoEsDeTodos https://t.co/jU9ykGWvH8"
"@josejserna","2018-05-20 23:37:27","Cierre de campaña @IvanDuque presidente, @mluciaramirez vicepresidente. Con ayuda de los compatriotas, que queremos recuperar el país, el próximo domingo estaremos celebrando el triunfo. Transmisión: https://t.co/daI4X9ZDx7 #DuqueGanador"
"@zegerIg","2018-05-20 23:37:28","Invito a todos los seguidores de @IvanDuque a trinar de aquí al 27 de mayo con #DuqueSoyYo para que a través de ese HT hagamos contagiosa nuestra empatía con la propuesta que encarna nuestro candidato."
"@lugicas","2018-05-20 23:37:28","@DuquePresidente @Malugoe ¡En 1a! ¡En 1a! ¡En 1a! Iván Duque es la esperanza de Colombia. Petro con el cuento del fraude, indica su derrota. Así @JuanManSantos y su horda de corruptos apelen a lo más ruin para evitar su triunfo, no lo lograrán. Sindéresis. Confianza en Dios. @IvanDuque."
"@pepenao1","2018-05-20 23:37:29","Futuro Presidente de Colombia, @IvanDuque y futura Primera Dama de la Nación, María Juliana Ruiz. #DuqueGanador #DuqueEnPrimeraVuelta https://t.co/QfGTiCigFk"
"@CentroAzul2023","2018-05-20 23:37:30","Si a vos no te da miedo ser gobernado por ex cabecilla de grupo criminal, q casi acaba a Bogotá, q quiere imponernos el socialismo de Chávez, a mi si. Por eso este 27 de mayo voto por @IvanDuque. https://t.co/4TmadEeGan"
"@carlos04449999","2018-05-20 23:37:31","@RevistaSemana @IvanDuque Ivan duque esta practicando para sabados felices acabar la corrupcion que buen chiste si el es el representante legal de ella.o es que le va a dar la espalda a su amo.el pequeño demonio.. como lo hizo santos en su tiempo. Jjaja definitivamente el chiste del año"
"@srestrepo98","2018-05-20 23:37:31","Mientras algunos tratan de estimular el odio de clases, @IvanDuque y @mluciaramirez han propuesto un país sin derroche, con menos impuestos, sin desgreño, con una economía Cristiana que, sustancialmente, incremente el salario mínimo de los colombianos #DuqueGanador"
"@mvicenteriveros","2018-05-20 23:37:31","Trabajaré con todos los presidentes de América para que se acabe la dictadura. No me gusta ser un presidente encumbrado en un palacio, porque mi palacio es el pueblo colombiano. @IvanDuque https://t.co/x9fJa9k15d"
"@ronaldleon2111","2018-05-20 23:37:36","Hoy tenemos la esperanza y firme convición, que nuestro próximo  Presidente será @IvanDuque #DuqueGanador @MovimientoMIRA  @Baena https://t.co/PoN7kqhtpu"
"@EDGARDOOSORIOCA","2018-05-20 23:37:36","#DuqueGanador #ColombiaEstáConDuque   Con tu voto ganamos en primera Vuelta.                                         No tengo ninguna Duda  Mi Voto   es Por #DuquePresidente  @IvanDuque  Y Tú? https://t.co/nYiblCWMt8"
"@boston_r_s","2018-05-20 23:37:37","Mientras algunos tratan de estimular el odio de clases, @IvanDuque y @mluciaramirez han propuesto un país sin derroche, con menos impuestos, sin desgreño, con una economía Cristiana que, sustancialmente, incremente el salario mínimo de los colombianos #DuqueGanador"
"@Briiank04","2018-05-20 23:37:38","Al señor @IvanDuque con cariño y respeto le digo: educación gratuita digital ya existe. Hay universidades como Harvard que proponen excelentes cursos, y como es de saber, no son cursos de una semana. Algunos pueden durar 8 y más semanas. Aquí  el Link. https://t.co/8MfcxX2cro"
"@todoscolombia","2018-05-20 23:37:38","Le aplicaremos al corrupto la extinción de dominio exprés . Vamos a endurecer las penas y se acabará la casa por Cárcel para el corrupto: @IvanDuque https://t.co/Ak4iRBZ2if"
"@edwinfabian2000","2018-05-20 23:37:39","@mariumega @edwinfabian2000 @joseadolfo6 @AlvaroUribeVel @IvanDuque @mluciaramirez @petrogustavo Si pero algunos fajardistas no conciben votar por Petro y si por el titere"
"@Hhmartinlopez","2018-05-20 23:37:40","Atención amigos de colombia humana, la gobernadora del valle Dilian francisca toro, hace un mes nos estaba presionando a todos los funcionarios públicos y contratistas que teníamos que hacerle campaña a Germán Vargas, ahora nos está presionando para que votemos por IVAN DUQUE."
"@comunicamiratru","2018-05-20 23:37:42","Nuestro presidente @Baena en compañía de los representantes @AnaPaolaAgudelo y @carlos_guevara en cierre de campaña de @IvanDuque y @mluciaramirez en el Parque el Tunal. Por la democracia en Colombia #DuqueGanador 🇨🇴 https://t.co/imS8UgFVEI"
"@jjotaorjuela","2018-05-20 23:37:42","Doctor @petrogustavo su publicacion y su insistencia en intentar mostrar LO QUE NO OCURRIO y que no corresponde a la verdad PONEN EN PELIGRO MI TRANQUILIDAD Y MI INTEGRIDAD. El saludo con El Dr. Duque FUE MUY CORDIAL.@IvanDuque, @NoticiasRCN @NoticiasCaracol @RevistaSemana https://t.co/JAy49Xrgo2"
"@pablorobayov","2018-05-20 23:37:42","Mientras algunos tratan de estimular el odio de clases, @IvanDuque y @mluciaramirez han propuesto un país sin derroche, con menos impuestos, sin desgreño, con una economía Cristiana que, sustancialmente, incremente el salario mínimo de los colombianos #DuqueGanador"
"@MarcoFi62463304","2018-05-20 23:37:44","#CierreDeCampaña | “No hemos dicho que al adicto se le lleve a la cárcel, al portador se le decomisa. Pero Al jíbaro es a la cárcel donde tiene que ir, donde le corresponde estar en un gobierno de autoridad”: @IvanDuque  https://t.co/GBdRifAzSv https://t.co/WSjIjXeGU7"
"@Presbecas","2018-05-20 23:37:44","Volanteando y dando a conocer las ventajas de votar por @IvanDuque y @mluciaramirez en primera vuelta. Andes capital comercial y cafetera de @MiSuroeste.  Nuestro equipo #JUNTOS. @AlvaroUribeVel @soyconservador @CeDemocratico @aodenicholls @AliciaArango @andresguerraho https://t.co/4EzTzPVngZ"
"@juandim1679","2018-05-20 23:37:46","A una semana de elecciones: !Llegó la hora! !Llegó la hora del cambio! !Llegó la hora de la esperanza! !Llegó la hora de Colombia! !Llegó la hora de @IvanDuque! https://t.co/e9QhlgixXk"
"@Cassalins02","2018-05-20 23:37:47","Uno tiene que ser un completo imbecil, carente de afecto y con muchas ganas de llamar la atención para utilizar una foto de un concierto de RAMMSTEIN y decir que es gente apoyando a @IvanDuque 😂 https://t.co/WLaq8DUvv6"
"@masagadi","2018-05-20 23:37:47","Increíble!!!!!  Monumental... @IvanDuque tuvo que hacer su cierre de campaña en el Parque El Tunal porque nuestra Plaza de Bolívar le quedó muy chiquita!!!!!  Aquí se ve lleno por fuera de los límites que se pusieron en el Parque!!!  Bravo!!!!!!👏👏👏👏👏👏👏👏 https://t.co/uH6B7yRbGF"
"@bucarito0911","2018-05-20 23:37:47","Increíble!!!!!  Monumental... @IvanDuque tuvo que hacer su cierre de campaña en el Parque El Tunal porque nuestra Plaza de Bolívar le quedó muy chiquita!!!!!  Aquí se ve lleno por fuera de los límites que se pusieron en el Parque!!!  Bravo!!!!!!👏👏👏👏👏👏👏👏 https://t.co/uH6B7yRbGF"
"@fcascardo","2018-05-20 23:37:47","Venezuela nunca creyó que el socialismo chavista los pondría a comer de la basura. En Colombia estamos advertidos, nuestra única opción para derrotar el populismo es Ivan Duque. NO al castrochavismo: Duque Presidente."
"@12345dubalier","2018-05-20 23:37:47","Vergacion a si sera el miedo de los duquistas  que  utilizan una foto de un concierto de RAMMSTEIN y que en santo tomas apoyando al titere @IvanDuque https://t.co/ynVkBE0Y9i"
"@jean02214","2018-05-20 23:37:49","El 27 de Mayo, votaré en Pereira, luego viajaré con mi hijo a Cali para que él vote, y en la tarde regresaremos a Pereira...hay que hacerlo, todos los votos cuentan, para que ganemos la presidencia con @IvanDuque , el de @AlvaroUribeVel , en primera vuelta!!!"
"@juandgc21","2018-05-20 23:37:50","Bueno no se asusten, Vargas Lleras también llenó la plaza de Bolívar en Bogotá. Lo importante es que @IvanDuque va a llenar son las urnas de votos y va a ganar en primera vuelta! ¡Póngale la firma! @Marangarcia @Rchagui @FEBUVE @ElNegrovicto https://t.co/y5pKtp3Brn"
"@emanuelagudelo","2018-05-20 23:37:50","Cierre de campaña en.Bogotá de @IvanDuque y @mluciaramirez, ellos harán un gobierno de unión de los colombianos donde el futuro sea de Todos https://t.co/BuBId9fzar"
"@nemahurtadoq","2018-05-20 23:37:51","La victoria se refleja en cierre de campaña en Bogotá de @IvanDuque y @mluciaramirez multitudinaria concentración en parque del Tunal al sur de la capital, augura que vamos a ganar en primera vuelta. https://t.co/hhKhDJ5Rtg"
"@AlejoMartin365","2018-05-20 23:37:51","@RevistaSemana @IvanDuque "Ayudarme a Derrotar la Corrupción" dice el candidato del Partido que mientras Goberno del 2002 al 2010 le Robaron a la Patria 190 BILLONES DE PESOS,A Punta de subsidiar multimillonarios como el Banquero Sarmiento Angulo al q Uribe le Regalo 40 MILLONES D DOLARES CON AGROINGRESO."
"@martaluciavilla","2018-05-20 23:37:52","Cierre de campaña @IvanDuque presidente, @mluciaramirez vicepresidente. Con ayuda de los compatriotas, que queremos recuperar el país, el próximo domingo estaremos celebrando el triunfo. Transmisión: https://t.co/daI4X9ZDx7 #DuqueGanador"
"@ronaldleon2111","2018-05-20 23:37:54","Arauca también está con @IvanDuque y @mluciaramirez , @MovimientoMIRA presente en Arauca Capital! Firmes! @irmalherrera @Baena @carlos_guevara https://t.co/dDJHHp7lpJ"
"@inditorralvo","2018-05-20 23:37:55","El gran ganador de esta campaña ha sido @IvanDuque  Joven, capacidad y visión de Estado y se ganó el corazón del electorado en una campaña honesta y limpia #DuqueGanador  Falta poco..."
"@JoseAndresOlaya","2018-05-20 23:37:55","@kuaj09 @angelapaez @SoyDrama @sergio_serrano_ @sergio_fajardo Más no te doy la razón @IvanDuque está más lejos de lo propuesto por la coalición."
"@Lipeh2004","2018-05-20 23:37:55","A una semana de elecciones: !Llegó la hora! !Llegó la hora del cambio! !Llegó la hora de la esperanza! !Llegó la hora de Colombia! !Llegó la hora de @IvanDuque! https://t.co/e9QhlgixXk"
"@1105_Colombiana","2018-05-20 23:37:56","Invito a todos los seguidores de @IvanDuque a trinar de aquí al 27 de mayo con #DuqueSoyYo para que a través de ese HT hagamos contagiosa nuestra empatía con la propuesta que encarna nuestro candidato."
"@BrugesPedro","2018-05-20 23:37:56","Multitudinario cierre de la campaña de @IvanDuque en el Parque el Tunal de Bogotá. Las intervenciones de @AlvaroUribeVel y @mluciaramirez dan cuenta del triunfo este 27 de Mayo.   #ColombiaEstáConDuque  #EsElQueEs https://t.co/A6W2CgOdrG"
"@jean02214","2018-05-20 23:37:57","Qué emoción tener tanta acogida en el cierre de @IvanDuque en Santo Tomás ,Atlántico, sin tener gobernadores ni alcaldes movilizando a través de los contratistas a la gente para que llenen las plazas públicas. Gracias a Carlos Rodado, Edgardo Jaramillo, @soyconservador , MIRA https://t.co/0QVAUObDlq"
"@nemahurtadoq","2018-05-20 23:37:58","Hoy Bogotá demuestra que quiere a Ivan Duque Presidente en primera vuelta. Este 27 de mayo vamos a derrotar el socialismo chavista y el continuismo santista. https://t.co/VNcrjCBQn8"
"@josejserna","2018-05-20 23:37:59","En una semana estaremos decidiendo el futuro de nuestro país. Tripliqueños esfuerzos y multipliquemos los votos, para que @IvanDuque sea nuestro presidente y @mluciaramirez nuestra vicepresidente, desde la noche del domingo.  ¡Ganemos #EnPrimeraVuelta!"
"@judas77","2018-05-20 23:37:59","@YoungCelis @mluciaramirez @IvanDuque Hahaha que foto tan falsa.. mas de la mitad de la plazoleta estaba llena de gente jugando futbol https://t.co/HQ3pYGBiNY"
"@ronaldleon2111","2018-05-20 23:38:02","Me encontré a los compañeros de @MovimientoMIRA en Diverplaza en Alamos y me bajé a agradecerles. Que gran socio tenemos. @IvanDuque @mluciaramirez https://t.co/uM0pYKcIXU"
"@alcal_83","2018-05-20 23:38:02","@AlvaroUribeVel @IvanDuque @mluciaramirez Usted si habla 💩. Lo más seguro es otra reforma pensional, más impuestos a la clase media y salarios mediocres. La verdad los mamertos son otros qué no reaccionan y se creen todas sus farsas. Ahorita dirá que escribirá en marmol sus propuestas...suena a dejavu..."
"@Yolycol","2018-05-20 23:38:03","Trabajaré con todos los presidentes de América para que se acabe la dictadura. No me gusta ser un presidente encumbrado en un palacio, porque mi palacio es el pueblo colombiano. @IvanDuque https://t.co/x9fJa9k15d"
"@flaviomarin1105","2018-05-20 23:38:03","#CierreDeCampaña | La mayor ovación en el cierre de campaña de @IvanDuque se lo llevó el expresidente Uribe. “Nuestra gratitud es a usted doctor Iván Duque de permitirnos apoyar esta propuesta suya que le hará tanto bien a la patria”: Uribe https://t.co/GBdRifAzSv https://t.co/Bj4nsYn3oY"
"@madkore_9","2018-05-20 23:38:02","@RevistaSemana @IvanDuque Claro que lo vamos a ayudar, lo vamos a ayudar no votando por ud, bueno, por uribe para ser más claro. Para recuperar la economía hay que derrotar a los corruptos, y el primer paso para derrotar a los corruptos es evitar que uno de ellos suba, evitar que uribe vuelva al poder."
"@puertodigital","2018-05-20 23:38:07","Uno tiene que ser un completo imbecil, carente de afecto y con muchas ganas de llamar la atención para utilizar una foto de un concierto de RAMMSTEIN y decir que es gente apoyando a @IvanDuque 😂 https://t.co/WLaq8DUvv6"
"@ceciliamr1948","2018-05-20 23:38:07","El sector textil y los taxistas de #Bucaramanga apoyan a @IvanDuque Presidente y @mluciaramirez Vicepresidenta en una gran jornada de pegatón.  Podemos ganar en #PrimeraVuelta. #DuqueEsElQueEs #SantanderConDuque https://t.co/s37v9zrXjR"
"@Delucerito","2018-05-20 23:38:07","#DuquePresidente Gracias Bogotá, multitudinaria asistencia al evento de cierre de campaña de @IvanDuque presidente @mluciaramirez vicepresidenta en El Tunal https://t.co/7Kf2HIecVC"
"@l_yta","2018-05-20 23:38:10","Mientras algunos tratan de estimular el odio de clases, @IvanDuque y @mluciaramirez han propuesto un país sin derroche, con menos impuestos, sin desgreño, con una economía Cristiana que, sustancialmente, incremente el salario mínimo de los colombianos #DuqueGanador"
"@edwinfabian2000","2018-05-20 23:38:11","@mariumega @StivenVela2 @joseadolfo6 @AlvaroUribeVel @IvanDuque @mluciaramirez @petrogustavo Es que no se trata de robledo, claudia o Fajardo se trata de las personas. A todos les metieron miedo con Petro, eso no se puede cambiar."
"@ronaldleon2111","2018-05-20 23:38:11","En Caldas @MovimientoMIRA firmes con @IvanDuque Presidente en primera vuelta #ConMIRADuquePresidente @baena @irmalherrera @gloria_stella @Virguez @carlos_guevara @aydeelizarazoc @AlvaroUribeVel @mluciaramirez @CeDemocratico https://t.co/pNlzXzxJog"
"@CotesBarr","2018-05-20 23:38:11","Mientras algunos tratan de estimular el odio de clases, @IvanDuque y @mluciaramirez han propuesto un país sin derroche, con menos impuestos, sin desgreño, con una economía Cristiana que, sustancialmente, incremente el salario mínimo de los colombianos #DuqueGanador"
"@Abel3561","2018-05-20 23:38:13","Nuestro presidente @Baena en compañía de los representantes @AnaPaolaAgudelo y @carlos_guevara en cierre de campaña de @IvanDuque y @mluciaramirez en el Parque el Tunal. Por la democracia en Colombia #DuqueGanador 🇨🇴 https://t.co/imS8UgFVEI"
"@flaviomarin1105","2018-05-20 23:38:14","Volanteando y dando a conocer las ventajas de votar por @IvanDuque y @mluciaramirez en primera vuelta. Andes capital comercial y cafetera de @MiSuroeste.  Nuestro equipo #JUNTOS. @AlvaroUribeVel @soyconservador @CeDemocratico @aodenicholls @AliciaArango @andresguerraho https://t.co/4EzTzPVngZ"
"@trabajador_dios","2018-05-20 23:38:14","¡No más Niñ@s violados,no más Niñ@s asesinados,no más Niñ@s secuestrados,no más Niñ@s maltratados! @IvanDuque sin vacilaciones se compromete a trabajar hasta lograr la #LeyGilmaJiménez prisión perpetua para los hampones que se meten con los Niñ@s. Por nuestros Niñ@s #DuqueGanador https://t.co/9pQm8tqSHj"
"@Sandra88111","2018-05-20 23:38:14","@USAenEspanol @WHAAsstSecty @marcorubio @RosLehtinen @JuanManSantos @AlvaroUribeVel @AndresPastrana_ @IvanDuque @mluciaramirez https://t.co/kRclz8NOKi"
"@Monicaalvarez68","2018-05-20 23:38:16","A una semana de elecciones: !Llegó la hora! !Llegó la hora del cambio! !Llegó la hora de la esperanza! !Llegó la hora de Colombia! !Llegó la hora de @IvanDuque! https://t.co/e9QhlgixXk"
"@meza_yamid","2018-05-20 23:38:16","A una semana de elecciones: !Llegó la hora! !Llegó la hora del cambio! !Llegó la hora de la esperanza! !Llegó la hora de Colombia! !Llegó la hora de @IvanDuque! https://t.co/e9QhlgixXk"
"@joogcol","2018-05-20 23:38:17","'Dentro de 8 días viene la verdadera encuesta, la encuesta de los ciudadanos que van a ejercer su derecho a votar. Ese día vamos a derrotar el socialismo del siglo XXI y el continuismo.' @IvanDuque"
"@ceciliamr1948","2018-05-20 23:38:19","Colombia grita: ¡Iván Duque Presidente! En 8 días los colombianos saldremos a votar masivamente por @IvanDuque Presidente y @mluciaramirez Vicepresidente. ¡Vamos a ganar en primera vuelta! #EnPrimeraVuelta https://t.co/B252cAPEsL"
"@masolc","2018-05-20 23:38:19","Uno tiene que ser un completo imbecil, carente de afecto y con muchas ganas de llamar la atención para utilizar una foto de un concierto de RAMMSTEIN y decir que es gente apoyando a @IvanDuque 😂 https://t.co/WLaq8DUvv6"
"@nomasgregorio","2018-05-20 23:38:20","@fhbejarano @Andrey2192 @landy_martine @LaMismaaa @petrogustavo @LuisAlfreRamos @IvanDuque Francisco hablamos de llenar plazas ? https://t.co/EZcT4RqGAT"
"@German84159811","2018-05-20 23:38:26","#CierreDeCampaña | La mayor ovación en el cierre de campaña de @IvanDuque se lo llevó el expresidente Uribe. “Nuestra gratitud es a usted doctor Iván Duque de permitirnos apoyar esta propuesta suya que le hará tanto bien a la patria”: Uribe https://t.co/GBdRifAzSv https://t.co/Bj4nsYn3oY"
"@CARLIUDEX","2018-05-20 23:38:28","@x4vier1 @Jorgomezpinilla @German_Vargas @petrogustavo @IvanDuque @CanalCapital Ahora entiendo lo del # de votantes en relación al tiempo en la encuesta de @lcvelez Será que el domingo de elecciones tendremos cositas varias.  Qué desgracia que no se pueda confiar en nada... https://t.co/nxlEXkM3d3"
"@sofiaescobarco","2018-05-20 23:38:30","Hoy Bogotá demuestra que quiere a Ivan Duque Presidente en primera vuelta. Este 27 de mayo vamos a derrotar el socialismo chavista y el continuismo santista. https://t.co/VNcrjCBQn8"
"@vidarte62","2018-05-20 23:38:32","Cierre de campaña Iván Duque @IvanDuque en el Tunal, Bogotá. Simplemente #ColombiaEstáConDuque . Ganemos en 1ra vuelta. #DuqueEsElQueEs #DuquePresidenteEnPrimeraVuelta https://t.co/KUnQezDOZh"
"@Porcolombia65","2018-05-20 23:38:34","#CierreDeCampaña | “En vez de ser un pelietas como yo, el doctor @IvanDuque es un gran pedagogo”: Uribe en el cierre de campaña en El Tunal https://t.co/GBdRifAzSv https://t.co/o2fXf3SLz4"
"@joseolfa","2018-05-20 23:38:34","Monumental! Hoy un río humano grita #DuqueGanador en Bogotá. Este 27 de mayo vamos a ganar en primera vuelta. La esperanza vive: Ivan Duque Presidente. https://t.co/2OYp68Zkmn"
"@arrietavega","2018-05-20 23:38:35","Mientras algunos tratan de estimular el odio de clases, @IvanDuque y @mluciaramirez han propuesto un país sin derroche, con menos impuestos, sin desgreño, con una economía Cristiana que, sustancialmente, incremente el salario mínimo de los colombianos #DuqueGanador"
"@AuntJemimaBlack","2018-05-20 23:38:37","A una semana del gran día seguimos demostrando que @IvanDuque es la mejor opción para Colombia.   Legalidad - Equidad y Emprendimiento.   #DuqueEnPrimera https://t.co/HyKFMS6qvu"
