"@bflopeza","2018-05-21 00:25:03","@AlvaroUribeVel @glorialozanob @IvanDuque Jajaja , payaso, @AlvaroUribeVel ud sabe que este títere si le responde bien a los hilos, váyase NO le haga más daño a Colombia, ya hizo lo que quería no siga haciendo daño detrás de otros, @IvanDuque ud sabe que de ser elegido será el vicepresidente, lo caga su patrón !"
"@JUANBAU12376462","2018-05-21 00:25:07","Mientras algunos tratan de estimular el odio de clases, @IvanDuque y @mluciaramirez han propuesto un país sin derroche, con menos impuestos, sin desgreño, con una economía Cristiana que, sustancialmente, incremente el salario mínimo de los colombianos #DuqueGanador"
"@PoliticaPuntual","2018-05-21 00:25:08","Si cada uno de los 6.431.000 #COLOMBIANOS  que amamos al país y que votamos #NO en el #PLEBISCITO nos comprometemos a conseguir un #VOTO para votar por @IvanDuque, arrasamos el 27 de Mayo y salvamos a #COLOMBIA de las garras de la #CORRUPCION, el #SOCIALISMO y el #NARCOTRAFICO"
"@Arrobanickname","2018-05-21 00:25:01","@CABLENOTICIAS Señores respeten! Esto es el cierre de @IvanDuque en el Tunal, Uds no mostraron imágenes de los asistentes y hablaron de 1.000 personas, ese es el periodismo basura del que habla Juan Gossain, se las dejo ahí! https://t.co/t6rkY69psg"
"@IanBlake83","2018-05-21 00:25:10","Uno tiene que ser un completo imbecil, carente de afecto y con muchas ganas de llamar la atención para utilizar una foto de un concierto de RAMMSTEIN y decir que es gente apoyando a @IvanDuque 😂 https://t.co/WLaq8DUvv6"
"@YbbYbello","2018-05-21 00:25:11","Gracias a Dios Colombia es un país donde aún se puede expresar la preferencia política. Yo espero respeto por mi decisión de apoyar a @IvanDuque .Tú? Elige con libertad, expresa tu opinión y engrandece la democracia en la que aún vivimos! #DuquePresidente"
"@hnablancav","2018-05-21 00:25:11","Un llamado de @JaimeCastroC que lo dice todo: "Si decidió votar por Ivan Duque en la segunda vuelta, hágalo en la primera, para que el pais ahorre los costos políticos, económicos y fiscales que tiene la segunda". #EnPrimeraVuelta"
"@salvo_ruiz","2018-05-21 00:25:14","@ecuanimusjustus @PiLaRPyNt0 @IvanDuque @AlvaroUribeVel hombre, que alegría leer un trino de estos, es como ver un soldado darlo todo por su patria."
"@juan80796344","2018-05-21 00:25:15","@AlvaroUribeVel @IvanDuque @mluciaramirez Economia cristiana ni que ocho cuartos...este encantador de pendejos ya no sabe que inventar...seguramente fue muy cristiana la economía bajo su mandato. Es un descarado"
"@cortes_cabra","2018-05-21 00:25:15","Magnifico cierre de campaña en Purificación. La comunidad firme con @IvanDuque, gracias a nuestro amigo @RicardoFerro_ por acompañarnos @AliciaArango https://t.co/8uDLLPJwAx"
"@melsa1957","2018-05-21 00:25:15","Gran cierre de campaña de @IvanDuque y @mluciaramirez  en Bogotá @MovimientoMIRA presente en compañía de @Baena @gloria_stella @AnaPaolaAgudelo @carlos_guevara y nuestros valiosos líderes. ¡El próximo 27 de mayo, vamos a ganar en primera vuelta! 🇨🇴 #ConMIRADuquePresidente https://t.co/WtcrE97754"
"@jescobar","2018-05-21 00:25:16","Todos los MIRAISTAS desde #Aruba apoyando a  @MovimientoMIRA @IvanDuque y a @mluciaramirez  Porque #ConMiraDuquePresidente   @AnaPaolaAgudelo @Baena @CDemocraticoUS https://t.co/Y6DeLrWEhM"
"@Cindy_Varmu","2018-05-21 00:25:16","Las mentiras del candidato @IvanDuque, las riquezas del subsuelo solo le han traído miseria a los pueblos donde se explota, en La Guajira niños mueren de hambre, en Cerro Matoso se  provoca daños irremediables al medio ambiente y a la salud de las personas. #NoAlFraudeElectoral https://t.co/sD3tAdBWBB"
"@Rolitorolito12","2018-05-21 00:25:17","Hicieron una votación única/ con propuestas (sin fotos) y ganó @petrogustavo. Últimos @IvanDuque y @German_Vargas.  Eso les debe dar una idea, ¿no?  #ColombiaQuiereAPetro ✌️"
"@usasebas","2018-05-21 00:25:18","¡Por Unicentro y alrededores @MovimientoMIRA Zona Norte apoyando a @IvanDuque @mluciaramirez porque unidos queremos proteger a nuestras mujeres y niños, fomentar el emprendimiento y garantizar libertad religiosa! #ConMiraDuquePresidente @Baena @OlgaVictoriaRC @criscarmoks https://t.co/Uq8Twq1EIe"
"@ElquinL","2018-05-21 00:25:18","A nuestros artistas del Valle del Cauca, gracias por creer en el cambio y en un mejor futuro, gracias por creer en @IvanDuque #ColombiaEstáConDuque https://t.co/Nj7OTU4zMW"
"@AvilaJulioce","2018-05-21 00:25:19","Es la imagen de las 2 de la tarde en el Parque del Túnel, en el cierre de la Campaña de #DuquePresidente  No es la Plaza de Bolívar llena de curiosos, no, es la gente que acompaño con fervor a @IvanDuque  como #DuquePresidente https://t.co/fn8RBkTtRd"
"@APadillaBossio","2018-05-21 00:25:19","Las mentiras del candidato @IvanDuque, las riquezas del subsuelo solo le han traído miseria a los pueblos donde se explota, en La Guajira niños mueren de hambre, en Cerro Matoso se  provoca daños irremediables al medio ambiente y a la salud de las personas. #NoAlFraudeElectoral https://t.co/sD3tAdBWBB"
"@tomasMedinaPere","2018-05-21 00:25:20","Monumental! Hoy un río humano grita #DuqueGanador en Bogotá. Este 27 de mayo vamos a ganar en primera vuelta. La esperanza vive: Ivan Duque Presidente. https://t.co/2OYp68Zkmn"
"@Leo_Lara_C","2018-05-21 00:25:23","#CierreDeCampaña | "Silenciaron al pueblo para hacer una obra que premiaba la codicia", dice @petrogustavo sobre Hidroituango. "Todo el que va a votar por @IvanDuque, sepa que está votando por la maquinaria de la corrupción en Colombia" https://t.co/GBdRifAzSv https://t.co/6kminOg1BX"
"@Waltert1","2018-05-21 00:25:25","@AlvaroUribeVel @IvanDuque @mluciaramirez Jajaja que buen chiste , usted le aumento las horas para quitar el recargo nocturno y el dominical , haciendo que los grandes empresarios no contrataran mas personas , si no al contrario , lo que genero es que explotaran más al empleado con extensas jornadas de trabajo"
"@Danmorca","2018-05-21 00:25:25","@fransuavgar @MovimientoMIRA @IvanDuque @mluciaramirez @Baena @gloria_stella @irmalherrera @carlos_guevara @OlgaVictoriaRC @SamirBedoya Triste decisión la del MIRA.. Slds"
"@renerevira","2018-05-21 00:25:25","Invito a todos los seguidores de @IvanDuque a trinar de aquí al 27 de mayo con #DuqueSoyYo para que a través de ese HT hagamos contagiosa nuestra empatía con la propuesta que encarna nuestro candidato."
"@OlgaCuorte","2018-05-21 00:25:26","@el_indocto @AlvaroUribeVel @IvanDuque Uribe @AlvaroUribeVel fue un presidente que:  - Regaló dinero a millonarios con AIS - Falsos positivos - Impulso el terrorismo - destruyó los recursos naturales - Llegó al ciudadano sanguinario, bélico, sin educación"
"@pedrosalazar420","2018-05-21 00:25:28","Uno tiene que ser un completo imbecil, carente de afecto y con muchas ganas de llamar la atención para utilizar una foto de un concierto de RAMMSTEIN y decir que es gente apoyando a @IvanDuque 😂 https://t.co/WLaq8DUvv6"
"@joguito_12","2018-05-21 00:25:29","Ellos 👉#ConMiraDuquePresidente hoy merecen todos los aplausos, se desplegaron por todos los rincones de Colombia para llevar el mensaje de @IvanDuque y @mluciaramirez . Gracias @MovimientoMIRA Que buena labor. #DuquePresidente #DuqueEsElQueEs #martalucíaesmivice 👏👏👏"
"@Anaelsyrestrep1","2018-05-21 00:25:31","Hoy acompañando a nuestro próximo Presidente @IvanDuque @mluciaramirez #ConMiraDuquePresidente #DuquePresidenteEnPrimeraVuelta @MovimientoMIRA https://t.co/kg9901mOXj"
"@MiSandovalA","2018-05-21 00:25:32","Tenemos los mejores médicos para derrotar el mal de la corrupción. La transparencia de @IvanDuque y @mluciaramirez es garantía para la Patria. #DuqueGanador"
"@rcsandra","2018-05-21 00:25:32","Hoy la fuerza de @MovimientoMIRA se hizo sentir en el cierre de campaña de @IvanDuque #ConMIRADuquePresidente @Baena @gloria_stella @AnaPaolaAgudelo @OlgaVictoriaRC @JairoCardozoS @irmalherrera https://t.co/E45Q5dIyHU"
"@usasebas","2018-05-21 00:25:34","Desde #NewYork #ColombianosEnElExterior estamos unidos apoyando a @IvanDuque para ser nuestro presidente electo #EnPrimeraVuelta #ConMIRADuquePresidente @MovimientoMIRA @Baena https://t.co/PSypiq3w4k"
"@Comocuandono","2018-05-21 00:25:34","Como cuando ni siquiera sabes cuál es la bandera de tu país y terminas haciéndole campaña a @IvanDuque con una bandera de Ecuador. Estos uribistas son muy chistosos. #Fail https://t.co/OKUmfMFC1c"
"@josequintero78","2018-05-21 00:25:34","Gran cierre de campaña de nuestro candidato @IvanDuque a esta hora en Cartagena.  ¡Conquistemos todos los días un voto más! #DuqueEnPrimeraVuelta  @IvanDuque Presidente @mluciaramirez Vicepresidente https://t.co/39Sll1Sx0E"
"@Anaelsyrestrep1","2018-05-21 00:25:35","Hoy líderes de @MovimientoMIRA en Antioquia reunidos con el @CeDemocratico para apoyar al candidato @IvanDuque. ¡Vamos a ganar en primera vuelta con el apoyo de @MovimientoMIRA! @juanf178 @LeoSolLopez @jtolozac https://t.co/opCdndgLKU"
"@lusecitagomes","2018-05-21 00:25:36","Gran cierre Cartagena. @IvanDuque aseguró: “ha llegado el momento de una nueva generación para transformar a Colombia, de hablar del país que anhelamos, que requiere legalidad para que toda la sociedad se pueda sentir segura”. #ElFuturoEsDeTodos Si podemos ganar #EnPrimeraVuelta https://t.co/HTqFPNmQy5"
"@Linitanueva","2018-05-21 00:25:37","El gran ganador de esta campaña ha sido @IvanDuque  Joven, capacidad y visión de Estado y se ganó el corazón del electorado en una campaña honesta y limpia #DuqueGanador  Falta poco..."
"@FelipeCabuyaS","2018-05-21 00:25:38","Hoy acompañando a nuestro próximo Presidente @IvanDuque @mluciaramirez #ConMiraDuquePresidente #DuquePresidenteEnPrimeraVuelta @MovimientoMIRA https://t.co/kg9901mOXj"
"@anamarce52","2018-05-21 00:25:39","La fotografía electoral parece seguir intacta. Llegaremos a una confrontación Duque-Petro, a menos que @German_Vargas se meta por la mitad con una propuesta de centro. La tendencia de @IvanDuque va a la baja y la de @petrogustavo al alza. La temperatura electoral sube"
"@chigo58336410","2018-05-21 00:25:39","Invito a todos los seguidores de @IvanDuque a trinar de aquí al 27 de mayo con #DuqueSoyYo para que a través de ese HT hagamos contagiosa nuestra empatía con la propuesta que encarna nuestro candidato."
"@LAPlazasVega","2018-05-21 00:25:39","#ColombiaEstáConDuque El país necesita recuperar la seguridad, restablecer la lucha contra el narcotráfico y perseguir el crimen para que haya justicia. 27 de Mayo todos a votar por @IvanDuque Presidente @mluciaramirez vicepresidenta https://t.co/USLalYGbE1"
"@ElquinL","2018-05-21 00:25:39","Nuestro compromiso es con Colombia, por eso trabajamos sin descanso recorriendo nuestro Valle del Cauca para ganar en 'Primera Vuelta' con @IvanDuque  Hoy con el diputado @juliocegarciav compartimos con la comunidad de Holguín municipio de la Victoria. #ColombiaEstáConDuque https://t.co/Pxplr7WR2n"
"@humanaradio_","2018-05-21 00:25:41","Atención amigos de colombia humana, la gobernadora del valle Dilian francisca toro, hace un mes nos estaba presionando a todos los funcionarios públicos y contratistas que teníamos que hacerle campaña a Germán Vargas, ahora nos está presionando para que votemos por IVAN DUQUE."
"@efraca14","2018-05-21 00:25:42","Cierre de campaña de @IvanDuque y @mluciaramirez en Bogotá. Por la unión de la Patria, por mayor legalidad, emprendimiento y justica social, votaremos este 27 de mayo por nuestra fórmula a la Presidencia y Vicepresidencia. https://t.co/reEFw7iNvT"
"@GPATTYVT","2018-05-21 00:25:42","Así hay que votar el próximo domingo 27 de mayo. ¡Las víctimas de las Farc no queremos más de lo mismo, ni a los mismos!  Por eso apoyamos la formula presidencial de @IvanDuque y @mluciaramirez 👍 https://t.co/tSrRRfk5ji"
"@JorgeEs06592161","2018-05-21 00:25:42","@compromisobol @sergio_fajardo @compromisociu Que Sergio @JERobledo y @ClaudiaLopez les mandan decir que:  1. Si @petrogustavo no gana en 1era vuelta  2. A 2a vuelta pasamos Petro y ( @IvanDuque o @German_Vargas ); y YoSergio de 3o o 4o"
"@marco_caldon","2018-05-21 00:25:43","@PirryOficial Como sufren los mamertos; como no encuentean vicios en @IvanDuque se pegan de estupideces. Yo apoyo a Duque, @AlvaroUribeVel @mluciaramirez @CeDemocratico y sigan sufriendo."
"@Anaelsyrestrep1","2018-05-21 00:25:45","En Olímpica #Bosa recreo seguimos apoyando #AcuerdoProgramático con @IvanDuque por qué #ConMIRADuquePresidente #ConMiraDuquePresidente  @Baena @mluciaramirez @AnaPaolaAgudelo @gloria_stella @carlos_guevara @JairoCardozoS @irmalherrera https://t.co/0zE1uX08z7"
"@joguito_12","2018-05-21 00:25:46","Nos encontramos en #Jamundí, #ValleDelCauca apoyando la campaña del Candidato a la Presidencia @IvanDuque. #ConMiraDuquePresidente @Baena https://t.co/gYXtv4O0QE"
"@MacerofaMartha","2018-05-21 00:25:47","Vergonzoso. Uribe lanza trino calificando de "buen muerto" testigo incómodo para Ramos,pero cuando indignación creció explicó que ese trino era de comunidad y que él solo  encomilló e @IvanDuque con tan frágil excusa exculpa a su jefe. Si esto es ahora, como ira a ser si ganan."
"@davidrg70","2018-05-21 00:25:47","La Parapolitica le sigue apostando a las #EleccionesColombia2018   Emeterio Montes heredero de la estructura política del exsenador William Montes, condenado por Parapolitica.  Apoyan a @IvanDuque https://t.co/hJBMYTciSl"
"@villitalopez66","2018-05-21 00:25:49","Un estadista jamás es títere de otros. Sólo obedece a los intereses nacionales . He visto en @IvanDuque un estadista//. ¿Usted será un títere de Uribe? Así nos respondió Iván Duque via @elPaiscali https://t.co/7YkBBhb8ZH"
"@SAPS2017","2018-05-21 00:25:49","Nuestra caravana ya se toma Bogotá porque con @IvanDuque vamos a ganar #EnPrimeraVuelta @CeDemocratico @mluciaramirez https://t.co/4dPV0o3reH"
"@UrielSalgado14","2018-05-21 00:25:50","Cordial saludo para todos no podré estar en el Cierre de Campaña en #Bogotá por temas de salud pero quiero invitarlos a todos para que acompañen a @IvanDuque #Presidente y @mluciaramirez #Vicepresidente   #NoTeLoPierdas #ElFuturoEsDeTodos #FannyCifuentes  @CeDemocratico https://t.co/A4pLbPs5ux"
"@usasebas","2018-05-21 00:25:51","Los jóvenes queremos un País con oportunidades, con emprendimiento y educación, por eso el próximo 27 de mayo decimos #ConMiraDuquePresidente @irmalherrera @IvanDuque @Baena https://t.co/y0LMqBjNip"
"@ClaudiaPinedaT","2018-05-21 00:25:52","Nuestros Miraistas en cierre de campaña de @IvanDuque y @mluciaramirez en el Tropical Park en #Miami #Florida. Por la democracia en Colombia #DuqueGanador @MovimientoMIRA @Baena #ConMiraDuquePresidente 🇨🇴 https://t.co/ltW3b5hkUf"
"@joguito_12","2018-05-21 00:25:52","Con @MovimientoMIRA en Valledupar Cesar apoyando a @IvanDuque a la Presidencia, #ConMIRADuquePresidente vamos con toda la fuerza del Miraismo. @Baena @AnaPaolaAgudelo @Virguez @gloria_stella @juanrcampo @JoseGZapataMIRA @Cesar_Comunica @enteratevpar https://t.co/vgAe4QGF6y"
"@AndresF68976471","2018-05-21 00:25:54","Atención amigos de colombia humana, la gobernadora del valle Dilian francisca toro, hace un mes nos estaba presionando a todos los funcionarios públicos y contratistas que teníamos que hacerle campaña a Germán Vargas, ahora nos está presionando para que votemos por IVAN DUQUE."
"@luchoj01","2018-05-21 00:25:56","#CierreDeCampaña | "Silenciaron al pueblo para hacer una obra que premiaba la codicia", dice @petrogustavo sobre Hidroituango. "Todo el que va a votar por @IvanDuque, sepa que está votando por la maquinaria de la corrupción en Colombia" https://t.co/GBdRifAzSv https://t.co/6kminOg1BX"
"@JUAN_FRANRB","2018-05-21 00:25:56","@CABLENOTICIAS Señores respeten! Esto es el cierre de @IvanDuque en el Tunal, Uds no mostraron imágenes de los asistentes y hablaron de 1.000 personas, ese es el periodismo basura del que habla Juan Gossain, se las dejo ahí! https://t.co/t6rkY69psg"
"@Anaelsyrestrep1","2018-05-21 00:25:57","Querían ver un ejército unido? Apoyamos los acuerdos programáticos firmados con presidente @IvanDuque en el exterior 🌍 #ConMIRADuquePresidente @MovimientoMIRA @Baena  @AnaPaolaAgudelo @aydeelizarazoc @_JorgeMunoz @carlos_guevara  @gloria_stella @JairoCardozoS #AlemaniaMiraista https://t.co/mB6XcSEvt9"
"@Montero_Eduar1","2018-05-21 00:25:57","Uno tiene que ser un completo imbecil, carente de afecto y con muchas ganas de llamar la atención para utilizar una foto de un concierto de RAMMSTEIN y decir que es gente apoyando a @IvanDuque 😂 https://t.co/WLaq8DUvv6"
"@Enrique49836015","2018-05-21 00:25:58","Dice @IvanDuque que trasladaría la embajada colombiana a Jerusalén: Una vergüenza mundial que nos ganaría el repudio de cientos de paises y millones y millones de personas. ¡Una traición a la causa de la paz!"
"@EmirLopez81","2018-05-21 00:26:00","Hoy la fuerza de @MovimientoMIRA se hizo sentir en el cierre de campaña de @IvanDuque #ConMIRADuquePresidente @Baena @gloria_stella @AnaPaolaAgudelo @OlgaVictoriaRC @JairoCardozoS @irmalherrera https://t.co/E45Q5dIyHU"
"@joguito_12","2018-05-21 00:26:00","Este Partido le aportará mucho al gobierno de @IvanDuque  Duque tiene excelentes ideas, es tranquilo, sabe escuchar y con MIRA y otras fuerzas políticas, lograremos sacar adelante este país. cuente con nuestro apoyo 👊  #ConMiraDuquePresidente https://t.co/O6xdDbqEkB"
"@ElquinL","2018-05-21 00:26:00","@IvanDuque y @mluciaramirez son la esperanza de Colombia. Acabemos el próximo domingo de una vez la incertidumbre sobre el futuro del país y cerremos la puerta al Socialismo del SXXI. Vote #DuqueGanador https://t.co/vy6IQEuK2z"
"@Octaholo","2018-05-21 00:26:01","#DuqueEnPrimeraVuelta 🇨🇴❤️  !! sin buses,sin bazuco,sin funcionarios obligados,sin contratistas comprados,sin 10.000 raponeros pagados,sin buses escalera repletos de indígenas !!.  💛💙❤️ @IvanDuque 💛💙❤️ 💛💙❤️ @mluciaramirez 💛💙❤️ https://t.co/hOy7xch3JS"
"@cdaramirez","2018-05-21 00:26:01","#CierreDeCampaña | "Silenciaron al pueblo para hacer una obra que premiaba la codicia", dice @petrogustavo sobre Hidroituango. "Todo el que va a votar por @IvanDuque, sepa que está votando por la maquinaria de la corrupción en Colombia" https://t.co/GBdRifAzSv https://t.co/6kminOg1BX"
"@BernateFelix","2018-05-21 00:26:02",".Desde #NewYork @MovimientoMIRA y @CeDemocratico unidos por @IvanDuque presidente #ConMiraDuquePresidente #DuqueEnPrimeraVuelta https://t.co/libDyvBrIs"
"@lduartear","2018-05-21 00:26:02","En Londres, colombianos de la Gran Alianza por Colombia y @MovimientoMIRA seguimos promoviendo nuestros candidatos  @IvanDuque y @mluciaramirez Gracias @AlvaroUribeVel y @FlondonoHoyos por hacernos sentir que hay esperanza! Vamos a ganar en 1a vuelta! Del 21 al 27 de mayo a votar https://t.co/4fAWUmCj7a"
"@AlonsoPenC","2018-05-21 00:26:05","Jefe de campaña de @IvanDuque en Medellín ve grave la vaina. Duque no tiene pueblo. Reciba los 100mil y vote por otro candidato que no sea este ni @German_Vargas https://t.co/dVzwPENJg4"
"@carlisgarcia191","2018-05-21 00:26:06","la afinidad y la manera de orientar la campaña de Duque, imita a Uribe en todo en sombrero en ropa en tono de voz en las palabras de discurso ...todo.  este es un candidato de mentiras hace todo lo que le dice Uribe. A gobernar de mentiras solo imagen.@IvanDuque @AlvaroUribeVel"
"@LeonelRomeroP","2018-05-21 00:26:07","Jefe de campaña de @IvanDuque en Medellín ve grave la vaina. Duque no tiene pueblo. Reciba los 100mil y vote por otro candidato que no sea este ni @German_Vargas https://t.co/dVzwPENJg4"
"@emigraldo","2018-05-21 00:26:07","Invito a todos los seguidores de @IvanDuque a trinar de aquí al 27 de mayo con #DuqueSoyYo para que a través de ese HT hagamos contagiosa nuestra empatía con la propuesta que encarna nuestro candidato."
"@SbastianPu","2018-05-21 00:26:09","La periodista @cayetanaAT entrevistó este domingo a @JuanManSantos en el  periódico Español @elmundoes con 69 preguntas en las cuales mintió en más del 90% de las respuestas ...    @AlvaroUribeVel @AndresPastrana_ @IvanDuque @cdetoro @AlfredoRamosM @MariaFdaCabal @ElJodario"
"@cristyllanor_c","2018-05-21 00:26:09","@IvanDuque @DeLaCalleHum @sergio_fajardo @petrogustavo  que no se les olvide y a nosotros tampoco a la hora de elegir al mejor. https://t.co/hrKssPPZLq"
"@agredo_liseth","2018-05-21 00:26:09","#DuqueGanador en equipo lograremos liderar iniciativas que otorguen a los ciudadanos garantías y oportunidades. @Baena @IvanDuque @mluciaramirez https://t.co/SAPLNpSOXa"
"@DDanielCCastro","2018-05-21 00:26:12","Echemos números: Cierres de campaña bogotá. Transmisiones en facebook.  @petrogustavo  405mil reprod. 13mil veces comp. 14mil Reacciones  @IvanDuque  33mil reprod. 908 veces comp. 4,1mil Reacciones  @German_Vargas  1mil reprod. 298 veces comp. 1,2mil Reaccio #NoAlFraudeElectoral"
"@jhonymaki","2018-05-21 00:26:12","#CierreDeCampaña | "Silenciaron al pueblo para hacer una obra que premiaba la codicia", dice @petrogustavo sobre Hidroituango. "Todo el que va a votar por @IvanDuque, sepa que está votando por la maquinaria de la corrupción en Colombia" https://t.co/GBdRifAzSv https://t.co/6kminOg1BX"
"@Patri_gogo","2018-05-21 00:26:12","@JoseMAcevedo @petrogustavo @German_Vargas @IvanDuque @DeLaCalleHum @sergio_fajardo Jejejeje!, que ingenuidad. Pues si los resultados son confiables asi será. Pero con esa regustraduria, cuál confianza?, cuál legalidad?"
"@Anaelsyrestrep1","2018-05-21 00:26:13","Por un gobierno que respete la Libertad Religiosa, @miraismoargenti dice: ¡@IvanDuque Presidente! 🇨🇴🗳✍ Semana de elecciones Presidenciales en el Exterior del 21 al 27 de mayo. #ConMIRADuquePresidente #MIRAEnElExteriorConDuquePresidente #MIRAenARGENTINAConDuquePresidente https://t.co/bwH4rSldJk"
"@andresguerraho","2018-05-21 00:26:17","Gracias Antioquia, cerramos campaña cómo empezamos, recorriendo el territorio, con amor, pasión, y profundo cariño, 96 municipios visitados en 5 meses. Lo dejamos todo en la cancha por @IvanDuque Presidente. @AlvaroUribeVel https://t.co/V2r1Q6E3XC"
"@svalerod","2018-05-21 00:26:18","Tenemos los mejores médicos para derrotar el mal de la corrupción. La transparencia de @IvanDuque y @mluciaramirez es garantía para la Patria. #DuqueGanador"
"@ialejomendoza1","2018-05-21 00:26:19","Es tan Simple como que Votar por @IvanDuque es refrendar, aprobar y reelegir ROBOS Y DESFALCOS Como: Agroingreso Odebrecht Reficar Zonas Francas CATASTROFES como; Chirajara Hidroituango Y MASACRES Como; Los Falsos Positivos El Aro La granja Una Persona de Bien JAMÁS APOYARIA ESO."
"@elguadualcucuta","2018-05-21 00:26:19","@JosueRobayo @IvanDuque @millersoto @argiro1961 @Tolaymaruja @franlcornejo @_El_Patriota @GusAdolfoOrtiz @ELMASGODO @totorangelm @Andy_RomeroC 👍👍🍊🍊🍊Siii en 1ra vuelta 🍊👍"
"@adrianallanten","2018-05-21 00:26:22","Los miraistas del sur de la Florida estamos con @Baena @MovimientoMIRA apoyando la candidatura de @IvanDuque y @mluciaramirez #ColombianosEnElExterior  #ConMiraDuquePresidente #MartaLucíaEsMiVice https://t.co/Xj4TwrYI5r"
"@cofiotto","2018-05-21 00:26:24","#CierreDeCampaña | "Queremos libertad y democracia para Venezuela": @mluciaramirez, de cara a un grupo de ciudadanos de ese país que asisten al cierre de campaña de @IvanDuque https://t.co/GBdRifAzSv https://t.co/LuAVpgKq6L"
"@hnablancav","2018-05-21 00:26:25","Ojalá el próximo domingo, a esta misma hora, estemos celebrando que @IvanDuque es el nuevo presidente electo.  #DuqueGanador https://t.co/RfJAtMoQVw"
"@guressito","2018-05-21 00:26:25","Miraístas en #Armenia #Quindío, gran ola azul fuerte y unida apoyando a @IvanDuque y @mluciaramirez. #QuindíoConDuque #ConMIRADuquePresidente https://t.co/QVgeLMNmWM"
"@urleyospina","2018-05-21 00:26:26","Así hay que votar el próximo domingo 27 de mayo. ¡Las víctimas de las Farc no queremos más de lo mismo, ni a los mismos!  Por eso apoyamos la formula presidencial de @IvanDuque y @mluciaramirez 👍 https://t.co/tSrRRfk5ji"
"@RickyAnthrop","2018-05-21 00:26:26","@AlvaroUribeVel @IvanDuque @mluciaramirez Economía Cristiana!?? Realmente ya no saben que decir ? Lo que ustedes ayudaron a forjar fue un Narco-Estado para los mega ricos. Santoyo y Arias docet!"
"@Enriquejimmyvar","2018-05-21 00:26:26","#CierreDeCampaña | "Silenciaron al pueblo para hacer una obra que premiaba la codicia", dice @petrogustavo sobre Hidroituango. "Todo el que va a votar por @IvanDuque, sepa que está votando por la maquinaria de la corrupción en Colombia" https://t.co/GBdRifAzSv https://t.co/6kminOg1BX"
"@Langel3325","2018-05-21 00:26:28","Petro llena una plaza diaria y @AlvaroUribeVel, @IvanDuque, @mluciaramirez llenan varios auditorios, coliseos y plazas al día. Por ejp: hoy fueron a El Banco, Chimichagua, Curumaní, Astrea, San Angel, Armenia, Valledupar y Cartagena. Ahí está el detalle.   #ColombiaEstáConDuque https://t.co/w7OHrTJszk"
"@vimaveur95","2018-05-21 00:26:29","Futuro Presidente de Colombia, @IvanDuque y futura Primera Dama de la Nación, María Juliana Ruiz. #DuqueGanador #DuqueEnPrimeraVuelta https://t.co/QfGTiCigFk"
"@MAINSARO","2018-05-21 00:26:33","@lugicas @RafaNietoLoaiza @IvanDuque @JuanManSantos @petrogustavo Hidroituango, el matrimonio paisa presidente Álvaro Uribe Vélez como testigo y uno de sus principales impulsores y el exgobernador Luis Alfredo Ramos. https://t.co/QdLvjPdJc7"
"@fredyo79","2018-05-21 00:26:34","Las mentiras del candidato @IvanDuque, las riquezas del subsuelo solo le han traído miseria a los pueblos donde se explota, en La Guajira niños mueren de hambre, en Cerro Matoso se  provoca daños irremediables al medio ambiente y a la salud de las personas. #NoAlFraudeElectoral https://t.co/sD3tAdBWBB"
