"@Claudia012062","2018-05-20 23:31:49","@Orokco @IvanDuque LOS COLOMBIANOS TE DAMOS LAS GRACIAS !!!! POR FAVOR, CONVENCE AL MENOS A UNO DE TUS JÓVENES AMIGOS. MIL GRACIAS !!! COLOMBIA NECESITA RETOMAR EL RUMBO !!!"
"@josemi422","2018-05-20 23:31:50","Mi Gente Llanera! FALTAN 9 DÍAS PARA LA VICTORIA @IvanDuque Presidente @mluciaramirez Vicepresidente Los invito a multiplicar los esfuerzos, a trabajar en equipo, a conquistar más amigos, a llevar el mensaje día a día en cada uno de los hogares @CeDemocratico @AlvaroUribeVel https://t.co/5LPOk6nt4i"
"@fernapiensa","2018-05-20 23:31:50","Cierre de campaña @IvanDuque @mluciaramirez en el exterior! #Miami #ExteriorConDuque #DuquePresidenteEnPrimeraVuelta @CDemocraticoUS @CeDemocratico @Juandavelez Todos con #DuqueEsElQueEs https://t.co/1npFHPHnz4"
"@DJALEJO","2018-05-20 23:31:51","@IvanDuque Los colombianos queremos un país SEGURO , TANTO EN EL AREA RURAL COMO EN EL AREA URBANA Y CASTIGOS EJEMPLARES A LOS DELINCUENTES , NO NOS DEFRAUDE  ... !"
"@gscasta","2018-05-20 23:31:51","El gran ganador de esta campaña ha sido @IvanDuque  Joven, capacidad y visión de Estado y se ganó el corazón del electorado en una campaña honesta y limpia #DuqueGanador  Falta poco..."
"@GERARDOHENAOJ","2018-05-20 23:31:52","Un llamado de @JaimeCastroC que lo dice todo: "Si decidió votar por Ivan Duque en la segunda vuelta, hágalo en la primera, para que el pais ahorre los costos políticos, económicos y fiscales que tiene la segunda". #EnPrimeraVuelta"
"@SteffaMoreno","2018-05-20 23:31:54","Nuestro presidente @Baena en compañía de los representantes @AnaPaolaAgudelo y @carlos_guevara en cierre de campaña de @IvanDuque y @mluciaramirez en el Parque el Tunal. Por la democracia en Colombia #DuqueGanador 🇨🇴 https://t.co/imS8UgFVEI"
"@faldanaS","2018-05-20 23:31:55","@RevistaSemana @IvanDuque Campaña de revista semana a ti Duque y vivir ampliando noticias del guerrillero Petro, señores juego limpio parecen mas de izquierda que otra cosa"
"@EduGuerreroV","2018-05-20 23:31:55","Es tan Simple como que Votar por @IvanDuque es refrendar, aprobar y reelegir ROBOS Y DESFALCOS Como: Agroingreso Odebrecht Reficar Zonas Francas CATASTROFES como; Chirajara Hidroituango Y MASACRES Como; Los Falsos Positivos El Aro La granja Una Persona de Bien JAMÁS APOYARIA ESO."
"@Manoloparis_","2018-05-20 23:33:08","La victoria se refleja en cierre de campaña en Bogotá de @IvanDuque y @mluciaramirez multitudinaria concentración en parque del Tunal al sur de la capital, augura que vamos a ganar en primera vuelta. https://t.co/hhKhDJ5Rtg"
"@LinaCFranco1","2018-05-20 23:33:08","@RevistaSemana @IvanDuque Como si subir los salarios y disminuir los impuestos fuera solo cuestión de voluntad del presidente de turno! Dónde está el estudio financiero que avala estas “promesas de campaña”, sin que la economía del país se vaya al traste? @sergio_fajardo @German_Vargas"
"@offrayLC","2018-05-20 23:33:10","¡FIASCO TOTAL! Raquítica asistencia en manifestación de @ivanduque en C/gena No fue suficiente presentación en tarima de cantantes Mr Black y Beto Zabaleta para llenar el emblemático Camellón de los Mártires Algo va de las "encuestas amañadas" a la movilización real en eventos https://t.co/NPuoUp0UMq"
"@gustavogomezra2","2018-05-20 23:33:10","Mi esposa, mis hijos y yo nos ponemos la camiseta por el futuro de los niños colombianos. Ellos merecen un país donde puedan crecer libres y tranquilos. Por eso, les inculcamos los valores familiares y democráticos que me enseñaron mis padres. Y votaremos @IvanDuque presidente. https://t.co/FWEIMMtlyT"
"@MiguelS69397877","2018-05-20 23:33:11","Gran cierre de campaña @IvanDuque en el parque El Tunal en Bogotá. ¡Vamos a ganar en primera vuelta!  Iván Duque Presidente Marta Lucía (@mluciaramirez) Vicepresidente #DuqueGanador https://t.co/5SD1SIukEX"
"@rojasfranco","2018-05-20 23:33:12","Hoy Bogotá demuestra que quiere a Ivan Duque Presidente en primera vuelta. Este 27 de mayo vamos a derrotar el socialismo chavista y el continuismo santista. https://t.co/VNcrjCBQn8"
"@MateoEs_10","2018-05-20 23:33:12","Monumental! Hoy un río humano grita #DuqueGanador en Bogotá. Este 27 de mayo vamos a ganar en primera vuelta. La esperanza vive: Ivan Duque Presidente. https://t.co/2OYp68Zkmn"
"@EDR_CD","2018-05-20 23:33:12","El humanismo debe ser la base y aquí en el Tunal les digo que me la juego por devolverle a los colegios la cátedra de urbanidad: @IvanDuque @mluciaramirez @AlvaroUribeVel"
"@MARIA12285967","2018-05-20 23:33:13","El gran ganador de esta campaña ha sido @IvanDuque  Joven, capacidad y visión de Estado y se ganó el corazón del electorado en una campaña honesta y limpia #DuqueGanador  Falta poco..."
"@berniprimero","2018-05-20 23:33:16","Mientras algunos tratan de estimular el odio de clases, @IvanDuque y @mluciaramirez han propuesto un país sin derroche, con menos impuestos, sin desgreño, con una economía Cristiana que, sustancialmente, incremente el salario mínimo de los colombianos #DuqueGanador"
"@Manoloparis_","2018-05-20 23:33:16","#CierreDeCampaña | “¿Están listos a ayudarme a derrotar la corrupción, si o no? ¿Están dispuestos a ayudarme a recuperar la economía, sí o no?”: con esas preguntas terminó @IvanDuque su discurso en el cierre de su campaña https://t.co/GBdRifAzSv https://t.co/MbUK6J2J4C"
"@SanchezMeljen","2018-05-20 23:33:17","Cierre de campaña @IvanDuque presidente, @mluciaramirez vicepresidente. Con ayuda de los compatriotas, que queremos recuperar el país, el próximo domingo estaremos celebrando el triunfo. Transmisión: https://t.co/daI4X9ZDx7 #DuqueGanador"
"@PatriciaMontoy6","2018-05-20 23:33:17","El humanismo debe ser la base y aquí en el Tunal les digo que me la juego por devolverle a los colegios la cátedra de urbanidad: @IvanDuque @mluciaramirez @AlvaroUribeVel"
"@KARLA56131","2018-05-20 23:33:18","Mientras algunos tratan de estimular el odio de clases, @IvanDuque y @mluciaramirez han propuesto un país sin derroche, con menos impuestos, sin desgreño, con una economía Cristiana que, sustancialmente, incremente el salario mínimo de los colombianos #DuqueGanador"
"@arciniegas595","2018-05-20 23:33:20","#CierreDeCampaña | “¿Están listos a ayudarme a derrotar la corrupción, si o no? ¿Están dispuestos a ayudarme a recuperar la economía, sí o no?”: con esas preguntas terminó @IvanDuque su discurso en el cierre de su campaña https://t.co/GBdRifAzSv https://t.co/MbUK6J2J4C"
"@EDGARDOOSORIOCA","2018-05-20 23:33:20","Mientras algunos tratan de estimular el odio de clases, @IvanDuque y @mluciaramirez han propuesto un país sin derroche, con menos impuestos, sin desgreño, con una economía Cristiana que, sustancialmente, incremente el salario mínimo de los colombianos #DuqueGanador"
"@YonisAlberto4","2018-05-20 23:33:20","La fotografía electoral parece seguir intacta. Llegaremos a una confrontación Duque-Petro, a menos que @German_Vargas se meta por la mitad con una propuesta de centro. La tendencia de @IvanDuque va a la baja y la de @petrogustavo al alza. La temperatura electoral sube"
"@edithsita201","2018-05-20 23:33:21","La alegría de acompañar la fuerza miraista en el Dpto de Atlántico.   Gran cierre de Campaña @IvanDuque y @mluciaramirez #ConMiraDuquePresidente @Baena @Virguez @MovimientoMIRA @Hectorpadillap https://t.co/PYNxCURnMs"
"@mlagder","2018-05-20 23:33:22","#CierreDeCampaña | “En vez de ser un pelietas como yo, el doctor @IvanDuque es un gran pedagogo”: Uribe en el cierre de campaña en El Tunal https://t.co/GBdRifAzSv https://t.co/o2fXf3SLz4"
"@jairochl","2018-05-20 23:33:26","@IvanDuque @Lilianaqkemp12 Duque no solo llena los recintos cerrados como dicen Petristas. Llena plazas con verdaderos Seguidores. No los llevan en buses. https://t.co/u0totxQ2Ze"
"@lrestrepo3","2018-05-20 23:33:27","Mientras algunos tratan de estimular el odio de clases, @IvanDuque y @mluciaramirez han propuesto un país sin derroche, con menos impuestos, sin desgreño, con una economía Cristiana que, sustancialmente, incremente el salario mínimo de los colombianos #DuqueGanador"
"@JOANLAJA","2018-05-20 23:33:29","EN MINUTOS: Transmisión en vivo desde el Parque el Tunal con la bancada del Partido acompañando cierre de campaña de @IvanDuque y @mluciaramirez #DuqueGanador 🇨🇴 https://t.co/9Y54TLjsag"
"@gdjorgee22","2018-05-20 23:33:29","Cierre de campaña @IvanDuque presidente, @mluciaramirez vicepresidente. Con ayuda de los compatriotas, que queremos recuperar el país, el próximo domingo estaremos celebrando el triunfo. Transmisión: https://t.co/daI4X9ZDx7 #DuqueGanador"
"@fijarme","2018-05-20 23:33:29","Los parásitos Petristas quieren elegir al asesino @petrogustavo para que les regale casa, carro, beca y viaje a la luna; los corruptos quieren elegir a @vargas_lleras para seguir robando; los uribistas queremos elegir a @IvanDuque por amor a la patria. Sencillo."
"@pepenao1","2018-05-20 23:33:29","Seguimos abriendo espacios de diálogo ciudadano, esta vez es la vereda Fontibón, en el municipio de Rionegro.   Unidos en sólo objetivo: @IvanDuque presidente en primera vuelta. #DuqueEsElQueEs https://t.co/ov2c6tE0r3"
"@latatamontengro","2018-05-20 23:33:32","El gran ganador de esta campaña ha sido @IvanDuque  Joven, capacidad y visión de Estado y se ganó el corazón del electorado en una campaña honesta y limpia #DuqueGanador  Falta poco..."
"@VICTORRESELLIS","2018-05-20 23:33:32","@RafaNietoLoaiza @IvanDuque En Febrero Duque era un pollito para sus contendores y ni lo volteaban a mirar en Marzo era apenas un pollo y lo miraban de reojo, en Abril se convirtió en el gallo que todos miran porque es el que más duro canta en el corral y en Mayo desplumó todos los gallos del gallinero"
"@ufoleon","2018-05-20 23:33:32","#CierreDeCampaña | “Vamos a bajar impuestos y a subir los salarios de los colombianos”, @IvanDuque . Ya el expresidente Uribe había dicho en tarima que un gobierno del Centro Democrático subiría el salario mínimo https://t.co/GBdRifAzSv https://t.co/kuiGyxKOzN"
"@andrutoy","2018-05-20 23:33:35","Monumental! Hoy un río humano grita #DuqueGanador en Bogotá. Este 27 de mayo vamos a ganar en primera vuelta. La esperanza vive: Ivan Duque Presidente. https://t.co/2OYp68Zkmn"
"@RanCarcris","2018-05-20 23:33:35","El 27 de Mayo, votaré en Pereira, luego viajaré con mi hijo a Cali para que él vote, y en la tarde regresaremos a Pereira...hay que hacerlo, todos los votos cuentan, para que ganemos la presidencia con @IvanDuque , el de @AlvaroUribeVel , en primera vuelta!!!"
"@keleonora","2018-05-20 23:33:35","Mientras algunos tratan de estimular el odio de clases, @IvanDuque y @mluciaramirez han propuesto un país sin derroche, con menos impuestos, sin desgreño, con una economía Cristiana que, sustancialmente, incremente el salario mínimo de los colombianos #DuqueGanador"
"@andimarin","2018-05-20 23:33:36","@RevistaSemana @IvanDuque Solo hay que tener sentido común para saber que bajar impuestos y subir salarios son tan inviables  como poco a realizables. Parecen propuestas de maduro!!. Mucho populismo y poco propuestas serias y realizables..."
"@DidierBecerra5","2018-05-20 23:33:37","La victoria se refleja en cierre de campaña en Bogotá de @IvanDuque y @mluciaramirez multitudinaria concentración en parque del Tunal al sur de la capital, augura que vamos a ganar en primera vuelta. https://t.co/hhKhDJ5Rtg"
"@FPamplonab","2018-05-20 23:33:37","Mientras algunos tratan de estimular el odio de clases, @IvanDuque y @mluciaramirez han propuesto un país sin derroche, con menos impuestos, sin desgreño, con una economía Cristiana que, sustancialmente, incremente el salario mínimo de los colombianos #DuqueGanador"
"@JOANLAJA","2018-05-20 23:33:37","Gracias Santo Tomás, gracias Atlantico, @IvanDuque Pdte. y @mluciaramirez VPdte., la dupla preparada para gobernar y trabajar por Colombia https://t.co/S4RPxtur7b"
"@SusanaGarzon3","2018-05-20 23:33:37","A una semana de elecciones: !Llegó la hora! !Llegó la hora del cambio! !Llegó la hora de la esperanza! !Llegó la hora de Colombia! !Llegó la hora de @IvanDuque! https://t.co/e9QhlgixXk"
"@FlorMalagon","2018-05-20 23:33:38","Mientras algunos tratan de estimular el odio de clases, @IvanDuque y @mluciaramirez han propuesto un país sin derroche, con menos impuestos, sin desgreño, con una economía Cristiana que, sustancialmente, incremente el salario mínimo de los colombianos #DuqueGanador"
"@carlosmon802","2018-05-20 23:33:38","Gracias Peque, amor por siempre paisanos, cariño de todos los días @IvanDuque Presidente, Gracias @AlvaroUribeVel por acompañarme, grandeza de un lider. https://t.co/ewbWqYsb1W"
"@jaguar375","2018-05-20 23:33:39","No trasladaré la embajada de Colombia a Jerusalén. Yo confío en que la afirmación de @IvanDuque haya sido solo una respuesta ligera. Nosotros no somos Trump para desafiar a la comunidad internacional: esas acciones audaces no nos representan ningún beneficio. @WRadioColombia"
"@lugicas","2018-05-20 23:33:39","¡En 1a! ¡En 1a! ¡En 1a! Iván Duque es la esperanza de Colombia. Petro con el cuento del fraude, indica su derrota. Así @JuanManSantos y su horda de corruptos apelen a lo más ruin para evitar su triunfo, no lo lograrán. Sindéresis. Confianza en Dios. @IvanDuque. https://t.co/BecS2dNRrg"
"@CarolinaMora79","2018-05-20 23:33:40","Cierre de campaña de @IvanDuque y @mluciaramirez en Bogotá. Por la unión de la Patria, por mayor legalidad, emprendimiento y justica social, votaremos este 27 de mayo por nuestra fórmula a la Presidencia y Vicepresidencia. https://t.co/reEFw7iNvT"
"@pachogomezb","2018-05-20 23:33:41","Por que #ColombiaEstáConDuque ?  @IvanDuque es parte de la nueva generación de lideres mundiales.  Jovenes. Brillantes. Con alta formacion. Demócratas. Sin corrupción. https://t.co/k697TFlJ7f"
"@ConductoresBOG","2018-05-20 23:33:43","#DuquePresidente Gracias Bogotá, multitudinaria asistencia al evento de cierre de campaña de @IvanDuque presidente @mluciaramirez vicepresidenta en El Tunal https://t.co/7Kf2HIecVC"
"@MAINSARO","2018-05-20 23:33:44","@IvanDuque Concuerdo con que el llenar plazas no siempre pone presidente. Mi punto esta en la forma como se llena y quién la llena. Resulta curioso que quienes participan en los eventos de Duque y Vargas en su mayoría se ven uniformaditos, con gorra y camisa, hasta con la misma pancarta."
"@pepenao1","2018-05-20 23:33:44","El equipo del Centro Democrático Londres junto al equipo del @MovimientoMIRA unidos, repartiendo publicidad e invitando a los #ColombianosEnLondres a votar por @IvanDuque Presidente @mluciaramirez Vicepresidente  #ColombianosEnElExterior #ExteriorConDuque #DuqueEnPrimeraVuelta https://t.co/81YUeCm9F3"
"@RamiroQ98792297","2018-05-20 23:33:44","#DuquePresidente Gracias Bogotá, multitudinaria asistencia al evento de cierre de campaña de @IvanDuque presidente @mluciaramirez vicepresidenta en El Tunal https://t.co/7Kf2HIecVC"
"@CarlosCaljiga","2018-05-20 23:33:45","#ColombiaEstáConDuque porque sin duda es una persona muy inteligente, que tiene la capacidad de gobernar esta linda patria q amo con todo mi corazón. Estoy seguro q @IvanDuque y @mluciaramirez  harán un gran trabajo por este país. @AlvaroUribeVel  @Ce"
"@lugicas","2018-05-20 23:33:45","@The__Bosch @juanjo311 @German_Vargas ¡En 1a! ¡En 1a! ¡En 1a! Iván Duque es la esperanza de Colombia. Petro con el cuento del fraude, indica su derrota. Así @JuanManSantos y su horda de corruptos apelen a lo más ruin para evitar su triunfo, no lo lograrán. Sindéresis. Confianza en Dios. @IvanDuque."
"@Yaneth04112010","2018-05-20 23:33:45","El 27 de Mayo, votaré en Pereira, luego viajaré con mi hijo a Cali para que él vote, y en la tarde regresaremos a Pereira...hay que hacerlo, todos los votos cuentan, para que ganemos la presidencia con @IvanDuque , el de @AlvaroUribeVel , en primera vuelta!!!"
"@Grupocolombiam2","2018-05-20 23:33:45","@SolerJeimi @petrogustavo @JuanManSantos @IvanDuque @German_Vargas @NoticiasRCN @elespectador @mluciaramirez @NoticiasCaracol @RevistaSemana @Registraduria Señora el gobierno ya dio su declaración. Y usted que afirma ser esclava tiene la libertad de marcharse de este país, será bien recibida en cuba, Bolivia, Venezuela o Rusia no creo que alguien la detenga."
"@mariumega","2018-05-20 23:33:45","Mientras algunos tratan de estimular el odio de clases, @IvanDuque y @mluciaramirez han propuesto un país sin derroche, con menos impuestos, sin desgreño, con una economía Cristiana que, sustancialmente, incremente el salario mínimo de los colombianos #DuqueGanador"
"@DarioUribe801","2018-05-20 23:33:48","Mientras algunos tratan de estimular el odio de clases, @IvanDuque y @mluciaramirez han propuesto un país sin derroche, con menos impuestos, sin desgreño, con una economía Cristiana que, sustancialmente, incremente el salario mínimo de los colombianos #DuqueGanador"
"@mdpgomez","2018-05-20 23:33:48","@LUCIALMAGUER @adrescala @araujoaristizab @YasserAminII1 @BlackSaurer @Santosterroris @petrogustavo @German_Vargas @PCambioRadical @IvanDuque @DeLaCalleHum Lo más seguro es que en menos de 4 años vuelva 💩💩 el país y ya para eso estaré fuera de Colombia,porque no soy masoquista. Con seguridad en las próximas elecciones a votar en contra de él aunque ya tenga los poderes en sus manos,y lucharán los estudiantes como en Vzla."
"@joraveols","2018-05-20 23:33:48","Atención amigos de colombia humana, la gobernadora del valle Dilian francisca toro, hace un mes nos estaba presionando a todos los funcionarios públicos y contratistas que teníamos que hacerle campaña a Germán Vargas, ahora nos está presionando para que votemos por IVAN DUQUE."
"@CARLOSP73260421","2018-05-20 23:33:49","#CierreDeCampaña | “Vamos a endurecer las penas y se acaba la casa por cárcel y la reducción de penas para cualquier corrupto”. @IvanDuque en El Tunal https://t.co/GBdRifAzSv https://t.co/OyoC9qM814"
"@EDGARDOOSORIOCA","2018-05-20 23:33:51","El gran ganador de esta campaña ha sido @IvanDuque  Joven, capacidad y visión de Estado y se ganó el corazón del electorado en una campaña honesta y limpia #DuqueGanador  Falta poco..."
"@trabajador_dios","2018-05-20 23:33:51","@ErikaSalamanca @IvanDuque ABAJO EL COMUNISMO, ABAJO PETRO, DE LA CALLE, FAJARDO. ARRIBA DUQUE. ABAJO EL MAYOR PATROCINADOR SATÁNICO DEL COMUNISMO: FRANCISCO MENTIROSO Y ANTICRISTO BERGOGLIO. LEE Y PROMULGA https://t.co/h8u5gjLU3M Y MIRA https://t.co/24Onmq5uAT https://t.co/fn24mEhuxh"
"@diegomez_18","2018-05-20 23:33:51","@resveracalvo @Realidades77 @alfacolombia @JESUSelias0805 @mmargarita1958 @CaracolRadio @cifrasyconcepto @IvanDuque @German_Vargas @petrogustavo @sergio_fajardo @DeLaCalleHum Tamales y lechón a que el señor duque y su campaña es experto ene repartir"
"@roger5co","2018-05-20 23:33:53","Como cuando te encuentras a un fanático religiosos seguidor de @IvanDuque y con sus odios desprecia a los demás por ello la mezcla de religión con política es un peligro para la sociedad. @sergio_fajardo @ClaMoralesM @AngelicaLozanoC @MabelLaraNews @ZuluagaCamila @sandraborda https://t.co/dq8MSbqAMl"
"@scarLeonardoOr2","2018-05-20 23:33:56","Atención amigos de colombia humana, la gobernadora del valle Dilian francisca toro, hace un mes nos estaba presionando a todos los funcionarios públicos y contratistas que teníamos que hacerle campaña a Germán Vargas, ahora nos está presionando para que votemos por IVAN DUQUE."
"@caarlosmurcia","2018-05-20 23:33:57","@RevistaSemana @IvanDuque Cómo se le llena la boca diciendo que quiere educación gratuita para los estratos más bajos. 😒😒😒 Pero lo dicen otros candidatos y los tilda de populistas.  No sea CÍNICO."
"@ledamejia21","2018-05-20 23:33:57","La victoria se refleja en cierre de campaña en Bogotá de @IvanDuque y @mluciaramirez multitudinaria concentración en parque del Tunal al sur de la capital, augura que vamos a ganar en primera vuelta. https://t.co/hhKhDJ5Rtg"
"@GERARDOHENAOJ","2018-05-20 23:33:58","Multitudinario cierre de la campaña de @IvanDuque en el Parque el Tunal de Bogotá. Las intervenciones de @AlvaroUribeVel y @mluciaramirez dan cuenta del triunfo este 27 de Mayo.   #ColombiaEstáConDuque  #EsElQueEs https://t.co/A6W2CgOdrG"
"@oscarhu022","2018-05-20 23:33:58","Venezuela nunca creyó que el socialismo chavista los pondría a comer de la basura. En Colombia estamos advertidos, nuestra única opción para derrotar el populismo es Ivan Duque. NO al castrochavismo: Duque Presidente."
"@yuyivel","2018-05-20 23:33:59","EN MINUTOS: Transmisión en vivo desde el Parque el Tunal con la bancada del Partido acompañando cierre de campaña de @IvanDuque y @mluciaramirez #DuqueGanador 🇨🇴 https://t.co/9Y54TLjsag"
"@lugicas","2018-05-20 23:33:59","Buen día, esto es lo que piensa el senador @AABenedetti de @German_Vargas  y anoche él fue el que llevó varios asistentes al cierre de campaña en Quilla, la política es dinámica  @NANACHAGU  @IvanDuque  @AlvaroUribeVel https://t.co/YqyLK7YEdP"
"@turco1417","2018-05-20 23:33:59","@AlvaroUribeVel @IvanDuque @mluciaramirez Senador @AlvaroUribeVel Economía cristiana Menos impuestos Aumento del mínimo? Cómo se hace? De eso tan bueno no dan tanto y menos a un inexperto como el títere @IvanDuque"
"@MacerofaMartha","2018-05-20 23:34:01","Atención amigos de colombia humana, la gobernadora del valle Dilian francisca toro, hace un mes nos estaba presionando a todos los funcionarios públicos y contratistas que teníamos que hacerle campaña a Germán Vargas, ahora nos está presionando para que votemos por IVAN DUQUE."
"@MARIA12285967","2018-05-20 23:34:04","Qué emoción tener tanta acogida en el cierre de @IvanDuque en Santo Tomás ,Atlántico, sin tener gobernadores ni alcaldes movilizando a través de los contratistas a la gente para que llenen las plazas públicas. Gracias a Carlos Rodado, Edgardo Jaramillo, @soyconservador , MIRA https://t.co/0QVAUObDlq"
"@BUSCADOR1373","2018-05-20 23:34:05","Uno tiene que ser un completo imbecil, carente de afecto y con muchas ganas de llamar la atención para utilizar una foto de un concierto de RAMMSTEIN y decir que es gente apoyando a @IvanDuque 😂 https://t.co/WLaq8DUvv6"
"@josevillabe24","2018-05-20 23:34:06","@IvanDuque @mluciaramirez @AlvaroUribeVel @CeDemocratico @Jorgitoceledon  PRESIDENTE @PipeBueno VICEPRESIDENTE ARRIBA COLOMBIA, AHORA SI SALIMOS DEL ATOYADEDO"
"@CARLOSP73260421","2018-05-20 23:34:06","#CierreDeCampaña | “Vamos a endurecer las penas y se acaba la casa por cárcel y la reducción de penas para cualquier corrupto”. @IvanDuque en El Tunal https://t.co/GBdRifAzSv https://t.co/OyoC9qM814"
"@MCristi66485088","2018-05-20 23:34:08","El gran ganador de esta campaña ha sido @IvanDuque  Joven, capacidad y visión de Estado y se ganó el corazón del electorado en una campaña honesta y limpia #DuqueGanador  Falta poco..."
"@cesar_garcia_nt","2018-05-20 23:34:08","Grave la denuncia de @petrogustavo sobre fraude.  A @IvanDuque lo subieron del 8% al 42% en una semana. @German_Vargas tiene la registraduria a su servicio, y no permitieron la verificación del software.  El fraude es inminente.   @OEA_oficial @UnionEuropeaRD"
"@Victor_Franc","2018-05-20 23:34:08","#CierreDeCampaña | “¿Están listos a ayudarme a derrotar la corrupción, si o no? ¿Están dispuestos a ayudarme a recuperar la economía, sí o no?”: con esas preguntas terminó @IvanDuque su discurso en el cierre de su campaña https://t.co/GBdRifAzSv https://t.co/MbUK6J2J4C"
"@UrielSalgado14","2018-05-20 23:34:09","Qué emoción tener tanta acogida en el cierre de @IvanDuque en Santo Tomás ,Atlántico, sin tener gobernadores ni alcaldes movilizando a través de los contratistas a la gente para que llenen las plazas públicas. Gracias a Carlos Rodado, Edgardo Jaramillo, @soyconservador , MIRA https://t.co/0QVAUObDlq"
"@prodeingenieria","2018-05-20 23:34:09","@silvioravel @manescorpioncar @RafaNietoLoaiza @IvanDuque ¡En 1a! ¡En 1a! ¡En 1a! Iván Duque es la esperanza de Colombia. Petro con el cuento del fraude, indica su derrota. Así @JuanManSantos y su horda de corruptos apelen a lo más ruin para evitar su triunfo, no lo lograrán. Sindéresis. Confianza en Dios. @IvanDuque."
"@judy_astrid","2018-05-20 23:34:09","@RevistaSemana @IvanDuque Es tal él descaro de usted Sr Duque que solo repite como loro las propuestas que realiza @petrogustavo, y sin embargo hace creer que la gente es populista, le recuerdo que usted es un oportunista de tiempo completo."
"@santiofficial86","2018-05-20 23:34:10","@AlvaroUribeVel @IvanDuque Cada día en la vida de duque vale por 7 de los nuestros, en 3 meses se puso canoso imagine 4 años, se muere de vejez 😂😂😂😂👇👇 https://t.co/RLc4SZiS2s"
"@pmill69","2018-05-20 23:34:11","Hoy Bogotá demuestra que quiere a Ivan Duque Presidente en primera vuelta. Este 27 de mayo vamos a derrotar el socialismo chavista y el continuismo santista. https://t.co/VNcrjCBQn8"
"@willigonzalezz","2018-05-20 23:34:12",".@IvanDuque (41,5%) y @petrogustavo (29,5%) lideran última encuesta a una semana de elecciones https://t.co/fBbarfsr33 #VocesySonidos https://t.co/5LiFj3PaZ4"
"@SusanaGarzon3","2018-05-20 23:34:12","@The__Bosch @juanjo311 @German_Vargas ¡En 1a! ¡En 1a! ¡En 1a! Iván Duque es la esperanza de Colombia. Petro con el cuento del fraude, indica su derrota. Así @JuanManSantos y su horda de corruptos apelen a lo más ruin para evitar su triunfo, no lo lograrán. Sindéresis. Confianza en Dios. @IvanDuque."
"@alfonsor61","2018-05-20 23:34:13","@IvanDuque saca pecho diciendo que nunca ha cometido ningún delito. Pensara lo mismo cuando encarcelen a su jefe @AlvaroUribeVel? Puede ser acusado de cómplice por encubrirlo"
